name,username,userId,can_dm,created_at,bio,tweets_count,followers_count,following_count,favourites_count,location,media_count,profile_banner_url,profile_url,avatar_url,verified,blue_verified
YANA,Yale_Nonprofit,'1948110992',false,2013-10-08 19:17:13,Yale Alumni Nonprofit Alliance (YANA). Working Together. Giving Back. Changing Lives. Tweets by YANA Social Media Committee,5508,1272,608,1165,New Haven to New Delhi!,691,https://pbs.twimg.com/profile_banners/1948110992/1381389687,https://www.twitter.com/Yale_Nonprofit,https://pbs.twimg.com/profile_images/378800000571944834/4c24b7e115a12ac7d0c5347e6d1885c2_normal.jpeg,false,false
Yale HRPP,YaleHRPP,'1911580988',false,2013-09-27 12:08:29,"Yale University Human Research Protection Program. Human Investigation Committee (biomedical) and Human Subjects Committee (social-behavioral, educational) IRBs",111,180,43,2,"New Haven, CT",2,https://pbs.twimg.com/profile_banners/1911580988/1381241526,https://www.twitter.com/YaleHRPP,https://pbs.twimg.com/profile_images/378800000566901706/19465359a597ea383cf7d2458fc00eb0_normal.jpeg,false,false
Yale Sociology,YaleSoc,'1598750377',false,2013-07-16 12:01:02,News from the Department of Sociology at Yale University,905,4877,57,192,"New Haven, CT",199,https://pbs.twimg.com/profile_banners/1598750377/1422038764,https://www.twitter.com/YaleSoc,https://pbs.twimg.com/profile_images/558697465713418240/MiNwCFvE_normal.jpeg,false,false
Yale CreativeWriting,YaleCrWriting,'1857343754',false,2013-09-12 08:56:55,Yale University's Creative Writing Program,2124,2481,1078,335,,57,https://pbs.twimg.com/profile_banners/1857343754/1472699125,https://www.twitter.com/YaleCrWriting,https://pbs.twimg.com/profile_images/378800000447105800/bcf05c4cbf2e1e1f2a7f97563da58c13_normal.jpeg,false,false
Stephen Pitti,stilesmaster,'276769779',false,2011-04-03 21:48:15,"Head of Ezra Stiles College, Professor of History and American Studies @Yale.",1216,553,429,578,Yale University,106,https://pbs.twimg.com/profile_banners/276769779/1379433019,https://www.twitter.com/stilesmaster,https://pbs.twimg.com/profile_images/2157989570/rubiks_normal.jpg,false,false
New Haven Indy,newhavenindy,'50183754',false,2009-06-23 22:22:05,"Breaking news and lively debate all about New Haven, Conn.",24488,14581,246,1009,"New Haven, Conn.",48,https://pbs.twimg.com/profile_banners/50183754/1561050112,https://www.twitter.com/newhavenindy,https://pbs.twimg.com/profile_images/1141753130297843715/9kXD5x6i_normal.png,false,true
Yale Art Gallery,YaleArtGallery,'362687208',false,2011-08-26 16:29:38,"Tweets from the galleries, behind-the-scenes photos, and more from America's oldest university art museum.",3172,15680,355,2086,"New Haven, Conn",858,https://pbs.twimg.com/profile_banners/362687208/1600978971,https://www.twitter.com/YaleArtGallery,https://pbs.twimg.com/profile_images/1019607783400968192/m4KJbwsK_normal.jpg,false,false
Paul Bloom,paulbloomatyale,'90169053',false,2009-11-15 09:16:00,"Psychologist who studies and writes about human nature—including morality, pleasure, and religion

(Artwork by MK Wynn: https://t.co/HLDAJgvYmE)",4128,93698,588,22343,"New Haven, CT",254,https://pbs.twimg.com/profile_banners/90169053/1475445994,https://www.twitter.com/paulbloomatyale,https://pbs.twimg.com/profile_images/782699128853704704/U5sCgy1C_normal.jpg,false,true
Vladimir Alexandrov,VEAlexandrov,'635411763',true,2012-07-14 08:03:56,Writer.ProfEmeritus@Yale. Epic bio coming 9/21 TO BREAK RUSSIA'S CHAINS: BORIS SAVINKOV AND HIS WARS AGAINST THE TSAR AND THE BOLSHEVIKS https://t.co/SDaCuhxvom,726,317,292,1092,Connecticut,16,https://pbs.twimg.com/profile_banners/635411763/1624290886,https://www.twitter.com/VEAlexandrov,https://pbs.twimg.com/profile_images/1406954468143472647/gLdKcukG_normal.jpg,false,false
Beverly Gage,beverlygage,'1225915808',false,2013-02-27 14:51:02,"Historian at Yale; biography of J. Hoover Edgar--G-Man: J. Edgar Hoover and the Making of the American Century--due out from Viking on Nov. 22, 2022",304,5849,491,280,,4,,https://www.twitter.com/beverlygage,https://pbs.twimg.com/profile_images/691265007917502464/W6jHgyx7_normal.jpg,false,false
LizAdriana2323,lizadriana2323,'14120576',false,2008-03-11 01:32:14,,12018,9959,1634,861,,593,https://pbs.twimg.com/profile_banners/14120576/1707128918,https://www.twitter.com/lizadriana2323,https://pbs.twimg.com/profile_images/1754451958595764225/rA7oHv3u_normal.jpg,false,false
Joyful Clemantine,clemantine1,'234191560',false,2011-01-04 20:48:33,"Author, Creative, Connector for just joy. I’m into dragons, gardens, and rainbow as “I Rise. I Rise. I Rise “- MayaAngelou",5845,4006,2021,8016,Earth,284,https://pbs.twimg.com/profile_banners/234191560/1650607657,https://www.twitter.com/clemantine1,https://pbs.twimg.com/profile_images/1376318389220638722/yj2DmPhj_normal.jpg,false,false
Sandra Boynton,SandyBoynton,'437176698',false,2011-12-14 22:06:02,"""Trying to Think of a Motto Since 1973."" Cartoonist, children’s author, songwriter, counterproductive kazooist.",4665,56837,30,4064,East and a little North,2946,https://pbs.twimg.com/profile_banners/437176698/1357393744,https://www.twitter.com/SandyBoynton,https://pbs.twimg.com/profile_images/961262031834898432/IgcdV4uD_normal.jpg,false,true
Doox of Yale,DooxOfYale,'170193432',false,2010-07-24 00:47:17,Doox of Yale (formerly The Duke's Men) are Yale's first (and best looking) all gender TTBB a cappella group! Find us on Instagram and Facebook!,561,506,90,58,Yale University,113,https://pbs.twimg.com/profile_banners/170193432/1583538891,https://www.twitter.com/DooxOfYale,https://pbs.twimg.com/profile_images/1172610466595725312/a7Jt0dvy_normal.jpg,false,false
Shades of Yale,ShadesofYale,'702986042',false,2012-07-18 08:39:32,"Shades of Yale, founded in 1988, is @Yale University's youngest a cappella group, singing music of the African Diaspora and African-American tradition.",153,320,158,9,"New Haven, CT",8,https://pbs.twimg.com/profile_banners/702986042/1438653266,https://www.twitter.com/ShadesofYale,https://pbs.twimg.com/profile_images/503973755627253761/vaWGZjHh_normal.jpeg,false,false
"John DeStefano, Jr.",John_DeStefano,'25496823',false,2009-03-20 08:42:22,,1129,2457,478,20,"New Haven, CT",30,https://pbs.twimg.com/profile_banners/25496823/1362490186,https://www.twitter.com/John_DeStefano,https://pbs.twimg.com/profile_images/378800000679075514/b428b879e0e7e8d844fc521770f57ba9_normal.jpeg,false,false
Ronan Farrow,RonanFarrow,'340613443',true,2011-07-22 20:15:26,Pulitzer-winning investigative journo @newyorker. Documentaries @hbo. Ex-diplomat. Bad lawyer. Disused PhD. Tips: ronan_farrow@newyorker.com.,2396,969868,5058,14412,Genovia,200,https://pbs.twimg.com/profile_banners/340613443/1732151396,https://www.twitter.com/RonanFarrow,https://pbs.twimg.com/profile_images/1515433189375987715/L6_IRSHH_normal.jpg,false,true
Nikolaj Birjukow,nikolajbirjukow,'22967319',false,2009-03-05 14:49:29,Managing Director of Marketing and Content for @Ogilvy and enthusiast for all things #Ogilvy. All tweets are not my own.,17426,114477,777,15206,Global,227,https://pbs.twimg.com/profile_banners/22967319/1528206629,https://www.twitter.com/nikolajbirjukow,https://pbs.twimg.com/profile_images/1003988571001270273/_onbva3b_normal.jpg,false,false
Ogilvy Consulting,OgilvyConsult,'376762488',false,2011-09-20 09:12:50,"Everything you need to know about tackling the toughest brand and marketing problems from the strategic consultancy at the heart of @Ogilvy

#TEAMOGILVY",8772,36001,945,7361,Global,924,https://pbs.twimg.com/profile_banners/376762488/1663766214,https://www.twitter.com/OgilvyConsult,https://pbs.twimg.com/profile_images/1572575594872815617/yPWQ9RR5_normal.jpg,false,false
RULER,rulerapproach,'225386150',false,2010-12-11 07:43:22,"An evidence-based approach to social & emotional learning. Learn about upcoming trainings at our website below. For more about our research, visit @YaleEmotion.",5603,18954,393,3331,"New Haven, Connecticut",1327,https://pbs.twimg.com/profile_banners/225386150/1647435685,https://www.twitter.com/rulerapproach,https://pbs.twimg.com/profile_images/885936312565366785/nYbhTu7F_normal.jpg,false,false
TEDxYale,TEDxYALE,'96353563',false,2009-12-12 09:38:39,"TEDxYale is an organization of students, working together to bring TED to Yale. Our Flagship Conference is taking place October 15th!",1349,1560,211,94,"New Haven, CT",136,https://pbs.twimg.com/profile_banners/96353563/1566761801,https://www.twitter.com/TEDxYALE,https://pbs.twimg.com/profile_images/447888008776126464/c9FF0_Uk_normal.jpeg,false,false
Yale in Hollywood,YaleinHollywood,'58740034',false,2009-07-21 04:07:57,Networking group for Yale alumni and friends in and interested in entertainment,1637,1044,69,314,Los Angeles,1070,https://pbs.twimg.com/profile_banners/58740034/1599688621,https://www.twitter.com/YaleinHollywood,https://pbs.twimg.com/profile_images/1813660837/bulldogshadessquare_normal.jpg,false,false
Windham-Campbell Prizes,WindhamCampbell,'1134947054',true,2013-01-30 14:20:38,The writer's prize. Find out who the 2024 #WindhamCampbellPrizes recipients are via the link below ⬇️,6755,49746,1894,4067,Yale University,1286,https://pbs.twimg.com/profile_banners/1134947054/1712081717,https://www.twitter.com/WindhamCampbell,https://pbs.twimg.com/profile_images/1775219461814898688/c89R9uct_normal.jpg,false,true
Paul Goldberger,paulgoldberger,'54972010',false,2009-07-08 13:55:40,"Architecture critic, educator, writer; author of BALLPARK: Baseball In the American City, published in 2019 by Knopf; Contributing Editor, Vanity Fair.",13393,25238,1184,18320,New York City (usually),410,https://pbs.twimg.com/profile_banners/54972010/1554843011,https://www.twitter.com/paulgoldberger,https://pbs.twimg.com/profile_images/833867789605752832/HiQb4HGw_normal.jpg,false,false
Nature Portfolio,NaturePortfolio,'487833518',true,2012-02-09 14:58:01,"Nature Portfolio’s high-quality products and services across the life, physical, chemical and applied sciences is dedicated to serving the scientific community.",24710,2210809,2404,6740,London,11940,https://pbs.twimg.com/profile_banners/487833518/1690549853,https://www.twitter.com/NaturePortfolio,https://pbs.twimg.com/profile_images/1393205274887049219/CpCGQiVy_normal.jpg,false,true
Johns Hopkins University,JohnsHopkins,'14441010',true,2008-04-19 02:35:58,America’s first research university. Leading discovery and sharing knowledge to better the world since 1876.,38373,240015,4442,16743,"Baltimore, MD",3421,https://pbs.twimg.com/profile_banners/14441010/1736367976,https://www.twitter.com/JohnsHopkins,https://pbs.twimg.com/profile_images/1158476160210210817/5L23zHvW_normal.jpg,false,true
National Cancer Institute,theNCI,'38530021',false,2009-05-07 18:11:47,The U.S. government’s agency for cancer research. Part of @NIH. Engagement ≠ endorsement. https://t.co/R9SpN6R3Fq,27007,223828,4498,7019,"Bethesda, MD",11033,https://pbs.twimg.com/profile_banners/38530021/1692041013,https://www.twitter.com/theNCI,https://pbs.twimg.com/profile_images/883052294945865729/1TckZQzv_normal.jpg,false,true
Sterling on Sterling,YDSDeanSterling,'771408306',false,2012-08-21 08:22:02,"Dean Greg Sterling, The Reverend Henry L. Slack Dean and Lillian Claus Professor of New Testament at Yale Divinity School",50,246,26,0,"New Haven, CT",0,,https://www.twitter.com/YDSDeanSterling,https://pbs.twimg.com/profile_images/2527796305/vueu78vim6k5tjjp30ti_normal.jpeg,false,false
Yale in London,YaleinLondon,'771480642',false,2012-08-21 09:10:24,Official Twitter for the Study Abroad Program offered through Yale University. Based at the Paul Mellon Center.,537,306,61,17,"London, England",49,https://pbs.twimg.com/profile_banners/771480642/1404813985,https://www.twitter.com/YaleinLondon,https://pbs.twimg.com/profile_images/2537907684/wdebr2e945zwp09p3ui9_normal.jpeg,false,false
The Tony Awards,TheTonyAwards,'34381878',false,2009-04-22 16:11:09,"The 78th Annual Tony Awards will take place on Sunday, June 8th at Radio City Music Hall ✨",15656,271935,815,12412,"New York, NY",4649,https://pbs.twimg.com/profile_banners/34381878/1727365298,https://www.twitter.com/TheTonyAwards,https://pbs.twimg.com/profile_images/1839329134386065409/OchVaqsJ_normal.jpg,false,false
Yale ITG,yaleitg,'196027304',false,2010-09-28 00:04:51,"Newer tweets at @YaleCTL

f/k/a Yale Instructional Technology Group. Supporting technology in teaching and learning since 1997.",1643,436,0,18,"New Haven, CT, USA",61,,https://www.twitter.com/yaleitg,https://pbs.twimg.com/profile_images/1622518047/itg_facebook_normal.jpg,false,false
Chris Incarvito,cincarvito,'412452062',false,2011-11-14 13:14:58,"Associate Provost for Science Initiatives @Yale
Research technology, lab design, golf, running, bread, shelties - not necessarily in that order.",2888,656,523,4258,"New Haven, CT",550,https://pbs.twimg.com/profile_banners/412452062/1546614246,https://www.twitter.com/cincarvito,https://pbs.twimg.com/profile_images/840053941870157824/n_c3mkYv_normal.jpg,false,false
Dina Mayzlin,dmayzlin,'29266729',false,2009-04-06 14:57:21,"Robert E. Brooker Chair in Marketing @ Marshall School of Business, University of Southern California, Associate Dean PhD Program, Research: word of mouth",510,935,920,1846,,41,https://pbs.twimg.com/profile_banners/29266729/1654871606,https://www.twitter.com/dmayzlin,https://pbs.twimg.com/profile_images/1535268862572105728/bieXpM9A_normal.jpg,false,false
Amy Chua,amychua,'283149384',true,2011-04-16 13:43:49,Yale Law professor. West Lafayette & El Cerrito High. Proud OG tiger mother of Sophia and Lulu. Recent author of Political Tribes and The Golden Gate.,3206,41328,831,5636,"New Haven, CT",288,https://pbs.twimg.com/profile_banners/283149384/1736868049,https://www.twitter.com/amychua,https://pbs.twimg.com/profile_images/1631698829111066632/X45eb5BE_normal.jpg,false,true
"Rev’d Professor Maggi Dawn, Ph.D",maggidawn,'29750782',false,2009-04-08 12:14:55,"🇺🇸 🇬🇧 Theologically orthodox, Liturgically sacramental, Temperamentally ecumenical. Episcopal priest(RI, USA) Professor of Theology, Durham UK",31029,13078,7957,5762,"Providence, RI, USA. Durham UK",697,https://pbs.twimg.com/profile_banners/29750782/1705011483,https://www.twitter.com/maggidawn,https://pbs.twimg.com/profile_images/1752312978383208448/dbj_R6Dt_normal.jpg,false,false
Miroslav Volf,MiroslavVolf,'449902720',false,2011-12-29 11:48:44,"Mildly dyslexic Prof. @YaleDivinitySchool; Director, @YaleCFC; Author: The Home of God (Brazos, 2022).",3361,36216,979,171,"Woodbridge, CT",338,https://pbs.twimg.com/profile_banners/449902720/1669339255,https://www.twitter.com/MiroslavVolf,https://pbs.twimg.com/profile_images/1500483980029841413/rYbi-of0_normal.jpg,false,false
Andrew Reeves,ajreeves,'2250261',false,2007-03-26 00:08:00,Director of @WeidenbaumCentr & Professor @WUSTLPoliSci; Author of the Particularistic President and No Blank Check.,1530,3031,1575,2285,"St Louis, MO",155,https://pbs.twimg.com/profile_banners/2250261/1609083554,https://www.twitter.com/ajreeves,https://pbs.twimg.com/profile_images/1794091179761364992/wEQ_59_i_normal.jpg,false,true
Ellie Powell,EllieNeffPowell,'369835240',false,2011-09-07 21:12:58,"Associate Professor of Political Science. Researching: Congress, Parties, and Money in Politics",799,2425,2831,1272,"Madison, WI",61,,https://www.twitter.com/EllieNeffPowell,https://pbs.twimg.com/profile_images/1666471980/Picture_of_me_1-1.png_normal.jpg,false,false
John W Emerson (Jay),johnwemerson,'110809853',false,2010-02-02 16:14:24,"Data Scientist
Director of Graduate Studies
Associate Professor of Statistics, Adjunct
Department of Statistics, Yale University",70,385,176,3,"New Haven, CT",0,,https://www.twitter.com/johnwemerson,https://pbs.twimg.com/profile_images/499575041940402176/C_qiqrOW_normal.png,false,false
A.W. Martin,awmartin,'14010012',false,2008-02-26 11:01:22,"Design technologist, product strategist, educator.
Computational design, generative ai, and urban/spatial tech.",1285,403,430,356,"New York, NY",71,,https://www.twitter.com/awmartin,https://pbs.twimg.com/profile_images/1765841561818972160/8Mbn1XW2_normal.jpg,false,false
James Aspnes,aspnes,'24618967',false,2009-03-15 20:45:28,Professor of Computer Science at Yale University,1,148,25,2,"Guilford, Connecticut, USA",0,,https://www.twitter.com/aspnes,https://pbs.twimg.com/profile_images/97269622/aspnes_normal.jpg,false,false
Emily Bazelon,emilybazelon,'28708146',true,2009-04-03 21:27:43,My latest book is CHARGED. (Find it at https://t.co/whO1jG7PT9). Staff writer NYT Mag. Co-host Slate Political Gabfest. Truman Capote Fellow at Yale Law School.,136,85960,871,5808,"New Haven, CT",2,https://pbs.twimg.com/profile_banners/28708146/1549846110,https://www.twitter.com/emilybazelon,https://pbs.twimg.com/profile_images/1245874205134065664/U8vy-mtc_normal.jpg,false,false
Immanuel Wallerstein,iwallerstein,'202539226',false,2010-10-14 04:04:29,Immanuel Wallerstein is a Senior Research Scholar at Yale University.,214,14421,0,0,"New Haven, CT",0,,https://www.twitter.com/iwallerstein,https://pbs.twimg.com/profile_images/1144824829/immanuel-wallerstein-sm_normal.jpg,false,false
Jack Balkin,jackbalkin,'78723806',false,2009-09-30 18:18:57,Con Law Prof and Director of Yale's Information Society Project and Abrams Institute for Free Expression,249,8312,522,0,"Branford, CT",7,,https://www.twitter.com/jackbalkin,https://pbs.twimg.com/profile_images/1881352580028088320/SfXKS1Hn_normal.jpg,false,false
Jason Lyall,jaylyall_red5,'382269545',false,2011-09-29 15:40:06,"Prof @Dartmouth. Director, FieldLab. Carnegie Fellow. Inequality, war, aid, Afghanistan, Russia. Author, DIVIDED ARMIES (2020, https://t.co/PmjTJjCKmv). 🇨🇦  #FirstGen",100,12690,1280,1499,Vermont,0,https://pbs.twimg.com/profile_banners/382269545/1581092787,https://www.twitter.com/jaylyall_red5,https://pbs.twimg.com/profile_images/545785279596867584/PqBC6zrL_normal.jpeg,false,false
There's a disco ball between us,jafariallen,'190774888',false,2010-09-14 16:19:08,"Jafari Sinclaire Allen. here & there. then & now. 
""Every night/ somethin' right/Would invite us to begin the dance"" (EW&F 1979). Views are exclusively my own.",2283,3308,1459,3886,(Mostly NYC & MIA),165,https://pbs.twimg.com/profile_banners/190774888/1634495948,https://www.twitter.com/jafariallen,https://pbs.twimg.com/profile_images/1449807085923885064/3GS51Ebi_normal.jpg,false,false
🦋 Karen Carpenter 🦋,KCdirector,'23318626',false,2009-03-08 11:35:51,"Theater Director|Drama Desk Award|🎭 Upcoming:🎶All the Rage, Brave New World✍🏻Lioness in Winter, Period Piece🤣Reading of Happy",26538,2705,4622,42462,Lenape Land/Upstate Manhattan,234,https://pbs.twimg.com/profile_banners/23318626/1724000110,https://www.twitter.com/KCdirector,https://pbs.twimg.com/profile_images/1825214824273383424/gyQjsrDi_normal.jpg,false,false
Stephen Dellaporta,sdellap,'16751331',false,2008-10-14 21:05:17,Yale Faculty Member,4,6,73,1,"New Haven, CT",0,,https://www.twitter.com/sdellap,https://pbs.twimg.com/profile_images/80231717/steve72_normal.jpg,false,false
Stephen Davis,StephenM_Davis,'29632531',false,2009-04-07 23:41:45,"Associate director and Senior Fellow, Harvard Law School Programs on Corporate Governance and Institutional Investors",1008,3604,895,1705,"Madison, Connecticut USA",16,https://pbs.twimg.com/profile_banners/29632531/1400005487,https://www.twitter.com/StephenM_Davis,https://pbs.twimg.com/profile_images/712670908062654464/pk-xXkzY_normal.jpg,false,false
Edward Tufte,EdwardTufte,'152862026',true,2010-06-06 22:24:03,"data visualization & analysis, artist, publisher. Founder: Graphics Press, Hogpen Hill Farms, ET Modern Gallery",14888,105479,4981,13832,Null Island  0°N  0°E,2420,https://pbs.twimg.com/profile_banners/152862026/1411432911,https://www.twitter.com/EdwardTufte,https://pbs.twimg.com/profile_images/458847900957556736/uArnnoBy_normal.png,false,true
International Security Studies,ISSYale,'494161198',false,2012-02-16 10:57:03,"ISS is dedicated to the study of history, grand strategy, & global security.",628,2511,327,191,"New Haven, CT",244,https://pbs.twimg.com/profile_banners/494161198/1722977779,https://www.twitter.com/ISSYale,https://pbs.twimg.com/profile_images/1674461932470910976/GSXKtl8y_normal.jpg,false,false
AAU,AAUniversities,'293709920',true,2011-05-05 16:48:50,"The Association of American Universities’ 71 research universities transform lives through education, research, and innovation.

Newsletter ➡️ https://t.co/3thRJzav3j",22713,19792,1045,3577,"Washington, DC",3948,https://pbs.twimg.com/profile_banners/293709920/1568738035,https://www.twitter.com/AAUniversities,https://pbs.twimg.com/profile_images/1546945510233317379/csvq021y_normal.jpg,false,false
NAICU,NAICUtweets,'121216491',false,2010-03-08 15:17:46,News & info from the Natl. Assn. of Independent Colleges and Universities. Also check out @NAICUheadlines. #DoublePell,2777,9396,1047,397,Washington DC,200,https://pbs.twimg.com/profile_banners/121216491/1354153431,https://www.twitter.com/NAICUtweets,https://pbs.twimg.com/profile_images/2460166521/ao1a2wacoifcbayypdya_normal.jpeg,false,false
NAICU News Roundup,NAICUheadlines,'11542772',false,2007-12-26 14:36:30,Today's top headlines about higher education compiled by the National Association of Independent Colleges and Universities. Also check out @NAICUtweets,20367,6206,92,0,"Washington, DC",0,https://pbs.twimg.com/profile_banners/11542772/1357937093,https://www.twitter.com/NAICUheadlines,https://pbs.twimg.com/profile_images/41692592/NAICU_normal.gif,false,false
Yale Philharmonia,YalePhil,'205990626',false,2010-10-21 21:38:29,The Philharmonia Orchestra of Yale is one of America’s foremost music school ensembles and the largest performing group at the Yale School of Music.,6,305,60,0,"New Haven, CT",0,,https://www.twitter.com/YalePhil,https://pbs.twimg.com/profile_images/1442609305/philharmonia2_press_normal.jpg,false,false
Karen N. Peart,KNPeartYale,'334215535',false,2011-07-12 15:08:21,Yale OPAC Media Relations,1672,705,984,407,,24,https://pbs.twimg.com/profile_banners/334215535/1491159042,https://www.twitter.com/KNPeartYale,https://pbs.twimg.com/profile_images/1722386812998492160/zDmAP7q1_normal.jpg,false,false
Yale Club of Georgia,YaleClubGa,'189597727',false,2010-09-11 14:11:52,The Yale Club of Georgia represents Yale in Georgia and allows alumni opportunities to support Yale and to join together in educational and social activities.,231,358,95,5,"Atlanta, Georgia",11,https://pbs.twimg.com/profile_banners/189597727/1534164837,https://www.twitter.com/YaleClubGa,https://pbs.twimg.com/profile_images/1121805785/YaleClubofGa_200x200_normal.jpg,false,false
Yale Black Alumni,YaleBlackAlumni,'351080666',false,2011-08-08 15:19:24,News about and for Yale alumni from the Official Yale Black Alumni Association.,3003,1470,238,177,,99,https://pbs.twimg.com/profile_banners/351080666/1591203902,https://www.twitter.com/YaleBlackAlumni,https://pbs.twimg.com/profile_images/484712930735173632/1x2c6WUz_normal.jpeg,false,false
Yale Cabaret,YaleCabaret,'177607065',false,2010-08-12 11:57:31,"A performance venue and artistic haven at the Yale School of Drama. We are an intersection for curious audiences, invigorating stories, and artistic excellence.",1782,553,76,96,"New Haven, CT",151,https://pbs.twimg.com/profile_banners/177607065/1536790738,https://www.twitter.com/YaleCabaret,https://pbs.twimg.com/profile_images/1039997304277741568/WzCk6p1c_normal.jpg,false,false
Yale Institute of Sacred Music,yaleism,'28158722',false,2009-04-01 14:14:06,"The Yale Institute of Sacred Music is an interdisciplinary graduate center dedicated to the study and practice of sacred music, worship, and the arts.",2951,1789,353,2520,"New Haven, CT",727,https://pbs.twimg.com/profile_banners/28158722/1715369524,https://www.twitter.com/yaleism,https://pbs.twimg.com/profile_images/1436349001037615110/JZMiekVL_normal.jpg,false,false
Yale GALA,YaleGALA,'114003401',false,2010-02-13 14:27:00,Yale's LGBT Alumni organization.,196,349,141,3,"Everywhere, honey.",4,,https://www.twitter.com/YaleGALA,https://pbs.twimg.com/profile_images/693820186/bulldog_rainbow_normal.jpg,false,false
Yale Women’s Hockey,YaleWHockey,'244632473',false,2011-01-29 14:25:48,"The official Twitter account for Yale Women's Hockey. NCAA Division I, ECAC Hockey & Ivy League member. #ThisIsYale",5569,6115,455,1059,"New Haven, CT",2427,https://pbs.twimg.com/profile_banners/244632473/1656653524,https://www.twitter.com/YaleWHockey,https://pbs.twimg.com/profile_images/1542742919903207424/eeOVNovo_normal.jpg,false,false
Yale College Council,theYCCtweets,'185451279',true,2010-08-31 20:52:08,Student Government at Yale College | now Zoom College Council,709,995,98,108,"New Haven, CT",109,https://pbs.twimg.com/profile_banners/185451279/1585436094,https://www.twitter.com/theYCCtweets,https://pbs.twimg.com/profile_images/1160947778207518721/PlieSaC0_normal.jpg,false,false
Yale Men's Lacrosse,YaleLacrosse,'216054838',false,2010-11-15 12:37:32,Official twitter account of Yale Men's Lacrosse. 2018 NATIONAL CHAMPIONS. 2019 National Finalists. 14x Ivy League Champions. #ThisIsYale,4904,23353,317,2060,"New Haven, CT",1904,https://pbs.twimg.com/profile_banners/216054838/1656653493,https://www.twitter.com/YaleLacrosse,https://pbs.twimg.com/profile_images/1542742736842829824/w1EykuqX_normal.jpg,false,false
Yale Out of the Blue,YaleOOTB,'24839473',false,2009-03-17 00:29:19,"Yale University's award-winning all-gender a cappella group, bringing current and classic pop/rock hits to audiences all over the world!",990,981,219,42,"New Haven, CT",200,https://pbs.twimg.com/profile_banners/24839473/1565631727,https://www.twitter.com/YaleOOTB,https://pbs.twimg.com/profile_images/1522541771/YaleOOTB_Logo_normal.png,false,false
