name,username,userId,can_dm,created_at,bio,tweets_count,followers_count,following_count,favourites_count,location,media_count,profile_banner_url,profile_url,avatar_url,verified,blue_verified
Yale Club Richmond,YaleClubRVA,'2747490132',false,2014-08-19 21:09:45,"Welcome to the Yale Club of Richmond, serving the alumni, families, friends, and supporters of Yale in Central Virginia, ranging from Hampton to Keysville.",80,171,79,1,"Richmond, Virginia",10,https://pbs.twimg.com/profile_banners/2747490132/1408507164,https://www.twitter.com/YaleClubRVA,https://pbs.twimg.com/profile_images/501950233194942466/a_QTZDnm_normal.png,false,false
Cincinnati Yale Club,CincyYaleClub,'296563485',false,2011-05-10 20:40:48,"Cincinnati Yale Club, founded in 1864, the oldest Yale alumni association in the country--right here in the Queen City!",54,144,26,6,"Cincinnati, OH",12,https://pbs.twimg.com/profile_banners/296563485/1424444145,https://www.twitter.com/CincyYaleClub,https://pbs.twimg.com/profile_images/1348068381/HandsomeDan_normal.jpg,false,false
Yale Central Valley,YaleCentralVall,'363526945',false,2011-08-28 02:58:07,Yale Club of the Central Valley: a network of @Yale alumni throughout Central California ... and the people who love them. Tweets by @tlc4college.,90,264,78,2,"Fresno, CA",14,,https://www.twitter.com/YaleCentralVall,https://pbs.twimg.com/profile_images/1517071760/Yale_logo_normal.jpg,false,false
Yale Club San Diego,yaleclubofsd,'87374904',false,2009-11-04 00:54:18,"The home of Yale alumni in San Diego. Dedicated to community service, intellectual enrichment and fun.",1617,521,175,1041,"San Diego, CA",557,https://pbs.twimg.com/profile_banners/87374904/1705971566,https://www.twitter.com/yaleclubofsd,https://pbs.twimg.com/profile_images/1663648408572424192/q1QhzcTO_normal.jpg,false,false
Yale Club of Los Angeles,YaleClubLA,'278202905',false,2011-04-06 16:28:16,Serving Yale University alumni in the greater LA area.,993,629,344,353,"Los Angeles, CA",95,https://pbs.twimg.com/profile_banners/278202905/1423977593,https://www.twitter.com/YaleClubLA,https://pbs.twimg.com/profile_images/1462066958979895297/hS0376XV_normal.jpg,false,false
LewisWalpoleLibrary,LewisWalpoleLib,'1154237520',false,2013-02-06 10:02:07,"The Lewis Walpole Library, a department of @YaleLibrary, in Farmington, CT, is a renowned research center for the study of Britain in the long 18th century.",2045,1749,579,1862,"Farmington, Connecticut",1433,https://pbs.twimg.com/profile_banners/1154237520/1692970970,https://www.twitter.com/LewisWalpoleLib,https://pbs.twimg.com/profile_images/1568341530879860743/xDPZplww_normal.jpg,false,false
Student Technology Collaborative,YaleSTC,'40900719',false,2009-05-18 11:54:55,The official Twitter page of the Yale Student Technology Collaborative! Helping Yale students with their tech needs since 1985.,76,408,796,127,"New Haven, CT",11,https://pbs.twimg.com/profile_banners/40900719/1584126203,https://www.twitter.com/YaleSTC,https://pbs.twimg.com/profile_images/1586033283346956290/cyuGoUjo_normal.jpg,false,false
Yale Child Study Center,YaleCSC,'113698114',false,2010-02-12 13:31:09,Official feed of the Yale Child Study Center at @YaleMed @YaleMedicine. Improving the lives of children & families. RTs & follows ≠ endorsement,5000,5567,519,4156,"New Haven, CT",606,https://pbs.twimg.com/profile_banners/113698114/1568836806,https://www.twitter.com/YaleCSC,https://pbs.twimg.com/profile_images/1544022257382596608/XLVkIX8Q_normal.jpg,false,false
Yale Med Alumni,YaleMedAlum,'127722006',false,2010-03-29 22:02:13,"Association of Yale Alumni in Medicine - reunions, events, connecting and re-connecting with one another and Yale",649,673,62,364,"New Haven, CT",234,https://pbs.twimg.com/profile_banners/127722006/1642186127,https://www.twitter.com/YaleMedAlum,https://pbs.twimg.com/profile_images/1780652181575667713/egsD5_N6_normal.jpg,false,false
Dwight Hall at Yale,DwightHallYale,'129568709',true,2010-04-04 14:51:04,"Dwight Hall is the Center for Public Service and Social Justice at Yale, a nonprofit umbrella organization that provides support to over 70 student-run groups.",1555,1262,550,651,"New Haven, CT",574,https://pbs.twimg.com/profile_banners/129568709/1604628969,https://www.twitter.com/DwightHallYale,https://pbs.twimg.com/profile_images/1336097297155887104/_kq9YDin_normal.jpg,false,false
Norfolk Chamber Music Festival,NorfolkYale,'158056526',false,2010-06-21 13:18:01,"Part of the Yale School of Music, Norfolk is a symbol of excellence in chamber music performance and professional study.",491,488,176,2,"Norfolk, CT",211,https://pbs.twimg.com/profile_banners/158056526/1568133469,https://www.twitter.com/NorfolkYale,https://pbs.twimg.com/profile_images/1171462183139434496/AOWCLTaI_normal.jpg,false,false
Yale Anthropology,Yale_Anthro,'179182411',false,2010-08-16 14:16:55,Yale University Department of Anthropology,567,5790,43,13,"New Haven, CT",55,https://pbs.twimg.com/profile_banners/179182411/1476122977,https://www.twitter.com/Yale_Anthro,https://pbs.twimg.com/profile_images/522055883287576576/Y1V3_781_normal.png,false,false
TO Yale,TOyale,'216437246',false,2010-11-16 13:39:02,"Yale Transportation Options is here to help you make transportation decisions that serve you, your community, and the environment.",2438,486,477,38,"Yale University, New Haven, CT",172,https://pbs.twimg.com/profile_banners/216437246/1495118790,https://www.twitter.com/TOyale,https://pbs.twimg.com/profile_images/954059003536879616/K57qKww5_normal.jpg,false,false
Yale Public Safety,Yalepblcsafety,'244722891',false,2011-01-29 19:17:56,Official page for Yale Public Safety.,2147,1356,1290,271,"New Haven, CT",407,https://pbs.twimg.com/profile_banners/244722891/1699977066,https://www.twitter.com/Yalepblcsafety,https://pbs.twimg.com/profile_images/1737231081579962368/GdfUuU5t_normal.jpg,false,false
YaleDayOfService,YaleDayService,'269908468',false,2011-03-21 13:29:54,Yale Day of Service is a global opportunity for Yale alumni to lead by sharing their time and talents to make a difference. #YaleDayOfService,1172,565,107,68,Worldwide,196,https://pbs.twimg.com/profile_banners/269908468/1580936977,https://www.twitter.com/YaleDayService,https://pbs.twimg.com/profile_images/1089905376340922368/5umcSDBZ_normal.jpg,false,false
Yale Classics Lib,YaleClassicsLib,'297746003',true,2011-05-12 21:34:09,The latest news & notes from the @Yale Classics Library @YaleLibrary; new resources for the study of the ancient world;,14233,12350,3802,50639,New Haven. CT,3818,https://pbs.twimg.com/profile_banners/297746003/1353419804,https://www.twitter.com/YaleClassicsLib,https://pbs.twimg.com/profile_images/1553597910/newclassics2_normal.jpg,false,false
University Printer,YalePrinter,'346684418',false,2011-08-01 13:37:25,Office of the Yale University Printer,136,408,41,0,"New Haven, CT",9,https://pbs.twimg.com/profile_banners/346684418/1403706286,https://www.twitter.com/YalePrinter,https://pbs.twimg.com/profile_images/479717835208282113/C6cYAOb6_normal.png,false,false
Yale ISPS,ISPSYale,'356389038',false,2011-08-16 15:43:06,"Yale University's Institution for Social and Policy Studies. Advancing research, shaping policy, developing leaders. Director: Alan Gerber",4502,3461,1545,1804,"New Haven, CT",416,https://pbs.twimg.com/profile_banners/356389038/1586182528,https://www.twitter.com/ISPSYale,https://pbs.twimg.com/profile_images/2875334059/95d66c4f7016d58711084d23c3063692_normal.jpeg,false,false
YaleBritishArt,YaleBritishArt,'468652016',false,2012-01-19 14:25:32,"The largest museum outside of the UK devoted to British art, the YCBA is a focal point for modernist architecture. Free and open to all. #YCBA",4609,10481,1231,2280,"New Haven, Connecticut",2083,https://pbs.twimg.com/profile_banners/468652016/1602800438,https://www.twitter.com/YaleBritishArt,https://pbs.twimg.com/profile_images/1836169386593296385/UEqa-xFc_normal.jpg,false,false
Yale Admissions,YaleUGA,'512336426',true,2012-03-02 14:03:55,Welcome to the official Twitter for the Office of Undergraduate Admissions at Yale! https://t.co/Mo7L15k7O0,2281,10896,330,1836,"New Haven, CT",658,https://pbs.twimg.com/profile_banners/512336426/1398959388,https://www.twitter.com/YaleUGA,https://pbs.twimg.com/profile_images/461895308570394625/IthptqZ0_normal.png,false,false
Bass Library,BassLibrary,'596636943',false,2012-06-01 11:27:43,Anne T. and Robert M. Bass Library | Starting point for undergraduate research and library instruction | @YaleLibrary,2158,768,410,687,"New Haven, CT",375,https://pbs.twimg.com/profile_banners/596636943/1399315973,https://www.twitter.com/BassLibrary,https://pbs.twimg.com/profile_images/1179100002859311111/e7baxs04_normal.jpg,false,false
Yale WorkLife,YaleWorkLife,'605891527',false,2012-06-11 20:59:13,"Yale's WL programs/services are part of Yale's efforts to help faculty/staff students manage responsibilities associated with work, academic, & personal life.",553,671,183,62,"New Haven, CT",5,,https://www.twitter.com/YaleWorkLife,https://pbs.twimg.com/profile_images/1096491508021248001/Bzs1JUys_normal.png,false,false
Yale At Olympics,YaleatOlympics,'614130636',false,2012-06-21 01:34:10,Affiliate of @YDNSports,285,272,79,9,from New Haven to Rio 2016,17,https://pbs.twimg.com/profile_banners/614130636/1469232643,https://www.twitter.com/YaleatOlympics,https://pbs.twimg.com/profile_images/756639667370528769/WOBQDLJp_normal.jpg,false,false
YaleWorldFellows,WorldFellows,'619315288',true,2012-06-26 14:29:29,An incubator for a new kind of global leadership,2515,6578,349,1906,Yale University,474,https://pbs.twimg.com/profile_banners/619315288/1711475950,https://www.twitter.com/WorldFellows,https://pbs.twimg.com/profile_images/1772684730527330304/SMItsVkI_normal.jpg,false,false
YaleOCDResearch,YaleOCDResearch,'802706564',false,2012-09-04 12:05:25,"Advancing knowledge of obsessive-compulsive disorder since 1985.

Learn more about participating in our research:
ocd.research@yale.edu
(203) 376-2035",1289,3353,408,159,"New Haven, CT",92,https://pbs.twimg.com/profile_banners/802706564/1354112658,https://www.twitter.com/YaleOCDResearch,https://pbs.twimg.com/profile_images/1669745641528995860/43nhUG-E_normal.jpg,false,true
play2PREVENT Lab,play2PREVENT,'805553970',false,2012-09-05 18:53:05,"We develop + evaluate serious #videogames for the purposes of #education, #riskreduction, #healthpromotion + #mentalhealth @GeiselMed @DartmouthCTBH",1244,865,1359,611,"Hanover, New Hampshire",275,https://pbs.twimg.com/profile_banners/805553970/1405425316,https://www.twitter.com/play2PREVENT,https://pbs.twimg.com/profile_images/1857527889605865472/B9rfT7Q3_normal.jpg,false,false
YaleGSAS,yalegsas,'829830397',false,2012-09-17 17:18:02,"America's oldest Graduate school est. 1847. Updates on GSAS students, activities and initiatives. Light and Truth. #edwardbouchet all day",1790,1531,247,769,"New Haven, CT",560,https://pbs.twimg.com/profile_banners/829830397/1398286504,https://www.twitter.com/yalegsas,https://pbs.twimg.com/profile_images/1179938135498788866/qem6ryt7_normal.jpg,false,false
Yale Digital Scholar,YaleDigScholar,'880978956',false,2012-10-14 17:02:04,,33,195,89,0,,0,https://pbs.twimg.com/profile_banners/880978956/1539637863,https://www.twitter.com/YaleDigScholar,https://pbs.twimg.com/profile_images/1051942991571681280/0opKnJQJ_normal.jpg,false,false
Yale Kavli Institute for Neuroscience,KavliAtYale,'1267922724',false,2013-03-14 16:35:17,"We aim to understand how genes, molecules, cells, & neural circuits interact to give rise to brain development and behavior.
Follow us @kavliatyale.bsky.social",2324,3418,509,1776,"New Haven, CT",302,https://pbs.twimg.com/profile_banners/1267922724/1724166084,https://www.twitter.com/KavliAtYale,https://pbs.twimg.com/profile_images/1825912389327323137/v4NJwuLD_normal.jpg,false,false
Yale Astronomy,YaleAstronomy,'1347540247',false,2013-04-12 15:09:10,The Department of Astronomy at Yale University.,314,1345,175,255,"New Haven, CT",17,https://pbs.twimg.com/profile_banners/1347540247/1464714813,https://www.twitter.com/YaleAstronomy,https://pbs.twimg.com/profile_images/737694434280624128/NLxO3DvU_normal.jpg,false,false
Yale West Campus,YaleWestCampus,'1364422040',false,2013-04-19 09:31:21,"A connecting point at Yale for scholarship in health, culture, energy, and the environment",2148,1869,899,4995,100 West Campus Drive,622,https://pbs.twimg.com/profile_banners/1364422040/1684170271,https://www.twitter.com/YaleWestCampus,https://pbs.twimg.com/profile_images/1154394630554869760/3pn5ewy9_normal.jpg,false,false
TEDxYaleWomen,TEDxYaleWomen,'1587316849',false,2013-07-11 21:54:03,get involved // nominate a speaker,37,156,127,4,Sat Dec 7 // NYC,1,https://pbs.twimg.com/profile_banners/1587316849/1373594728,https://www.twitter.com/TEDxYaleWomen,https://pbs.twimg.com/profile_images/378800000171001559/9936386dfc63746d9515bc59c57cf550_normal.png,false,false
Yale Film Archive,YaleFilmArchive,'1702883156',false,2013-08-26 16:36:57,"The Yale Film Archive, @YaleLibrary, advances film culture @Yale through collection, preservation, access, and exhibition.",4735,2340,197,748,"New Haven, CT",2832,https://pbs.twimg.com/profile_banners/1702883156/1710705431,https://www.twitter.com/YaleFilmArchive,https://pbs.twimg.com/profile_images/1346486553074409473/OIjr8Ej0_normal.jpg,false,false
Yale Network Science,YINSedge,'2338824692',false,2014-02-11 13:57:55,"Yale Institute for Network Science. Events. News. Cool stuff about network science, data science, science in general. And related matters.",2662,3290,484,829,Yale University,379,https://pbs.twimg.com/profile_banners/2338824692/1429591937,https://www.twitter.com/YINSedge,https://pbs.twimg.com/profile_images/433317772718649344/zPMu-mkG_normal.png,false,false
RLST @ Yale,RLSTYale,'2456596940',false,2014-04-21 09:20:00,defining religion since 1963,474,899,182,62,just off the New Haven Green,25,https://pbs.twimg.com/profile_banners/2456596940/1398087879,https://www.twitter.com/RLSTYale,https://pbs.twimg.com/profile_images/469511954894036992/MErpkxGA_normal.jpeg,false,false
Yale AACC,YaleAACC,'2715971414',false,2014-08-07 22:58:56,Asian American Cultural Center at Yale. We promote Asian American culture and explore the social and political experience of Asians in the United States.,267,311,75,38,"New Haven, CT",24,https://pbs.twimg.com/profile_banners/2715971414/1505956647,https://www.twitter.com/YaleAACC,https://pbs.twimg.com/profile_images/498207781963309056/f3ZDHq8D_normal.png,false,false
IPCH at Yale,IPCH_Yale,'2813657209',false,2014-09-16 15:54:51,Yale's Institute for the Preservation of Cultural Heritage - West Campus,317,629,76,137,"West Haven, CT, USA",17,https://pbs.twimg.com/profile_banners/2813657209/1472734850,https://www.twitter.com/IPCH_Yale,https://pbs.twimg.com/profile_images/771333851419467776/Q0z-69C6_normal.jpg,false,false
YPDC,YalePDC,'2831643167',false,2014-10-15 10:05:58,Yale Psychology Department Clinic. Treatment for adolescents and adults in and around Connecticut. Affordable mental health services at Yale.,56,185,40,17,"New Haven, CT",4,https://pbs.twimg.com/profile_banners/2831643167/1413382913,https://www.twitter.com/YalePDC,https://pbs.twimg.com/profile_images/522946821174202370/8gnBGsAy_normal.jpeg,false,false
The YODA Project,YODAProject,'2599797763',false,2014-07-02 08:36:37,"The @YaleMed Open Data Access (YODA) Project advocates for the responsible sharing of clinical research data, open science, and research transparency",788,913,188,64,"New Haven, CT",20,,https://www.twitter.com/YODAProject,https://pbs.twimg.com/profile_images/524559873250308097/Xa_-zxcd_normal.png,false,false
Women In Tech,WITatYale,'1365110550',false,2013-04-19 14:45:08,WIT@Yale is a shared interest group whose goal is to empower and support a community of women in information technology.,423,406,85,47,Yale University,108,https://pbs.twimg.com/profile_banners/1365110550/1485182815,https://www.twitter.com/WITatYale,https://pbs.twimg.com/profile_images/818847330304753665/CbGRkhWr_normal.jpg,false,false
CCS - Yale,CCSYale,'2795103472',false,2014-09-30 11:08:13,,276,447,39,2,,36,https://pbs.twimg.com/profile_banners/2795103472/1412091281,https://www.twitter.com/CCSYale,https://pbs.twimg.com/profile_images/516975174814416896/vI5quCNG_normal.jpeg,false,false
Yale Ventures,Yale_Ventures,'2353759326',false,2014-02-20 15:38:01,Helping develop innovations that impact the world's greatest challenges.,3789,2045,921,2142,"433 Temple St., New Haven, CT",984,https://pbs.twimg.com/profile_banners/2353759326/1656611527,https://www.twitter.com/Yale_Ventures,https://pbs.twimg.com/profile_images/1599823998086529031/6Uo3OQxO_normal.jpg,false,false
Yale Africa,yaleafrica,'2829749962',true,2014-10-14 11:39:14,Yale Africa Initiative: Bringing Africa to @Yale & @Yale to Africa,1939,4309,473,1950,"New Haven, CT",464,https://pbs.twimg.com/profile_banners/2829749962/1609717578,https://www.twitter.com/yaleafrica,https://pbs.twimg.com/profile_images/1258907419503136768/HIO4btLf_normal.jpg,false,false
Yale DHWG,yale_dhwg,'1688883667',false,2013-08-21 13:42:45,Representing the Digital Humanities Working Group at Yale University,2049,858,199,4,New Haven,19,,https://www.twitter.com/yale_dhwg,https://pbs.twimg.com/profile_images/441985025802641408/64CQgC5k_normal.png,false,false
The House at Yale,211ParkStreet,'840212990',false,2012-09-22 14:19:35,This is the official twitter feed of the Afro-American Cultural Center at Yale.,527,672,99,0,,8,https://pbs.twimg.com/profile_banners/840212990/1674776511,https://www.twitter.com/211ParkStreet,https://pbs.twimg.com/profile_images/1618756335876685824/boJcxCwk_normal.jpg,false,false
Jim Shelton,JimboShelton,'272451302',false,2011-03-26 10:56:27,"Senior Communications Officer for Science & Medicine, Yale University.",5544,1319,915,229,"New Haven, CT",137,,https://www.twitter.com/JimboShelton,https://pbs.twimg.com/profile_images/1287909806/chicago_bears_normal.jpg,false,false
Yale Cancer Center,YaleCancer,'851106744',false,2012-09-28 09:59:18,Yale Cancer Center is a collaboration between renowned cancer researchers and physicians @Yale and @SmilowCancer.,8946,16378,1801,9409,"New Haven, Connecticut",3420,https://pbs.twimg.com/profile_banners/851106744/1644948731,https://www.twitter.com/YaleCancer,https://pbs.twimg.com/profile_images/2677145875/7b19038cde0e7e9664bb887f10eb2639_normal.jpeg,false,true
Yale History,yale_history,'2176832317',false,2013-11-05 16:21:19,"History Department at Yale University, official Twitter account.",3544,4195,230,3785,"New Haven, CT",266,https://pbs.twimg.com/profile_banners/2176832317/1483556868,https://www.twitter.com/yale_history,https://pbs.twimg.com/profile_images/1433088273388171265/0u_ifFjN_normal.jpg,false,false
YaleClinicalResearch,yalediscovers,'1071785888',false,2013-01-08 14:31:03,Yale conducts hundreds of clinical trials to test cutting-edge treatments for many diseases. Find out how you can Help Us Discover at http://t.co/X6AglpY0,3769,1769,219,2961,New Haven,130,https://pbs.twimg.com/profile_banners/1071785888/1399669495,https://www.twitter.com/yalediscovers,https://pbs.twimg.com/profile_images/466948711080148992/yrE4jWkF_normal.jpeg,false,false
yaleiilab,yaleiilab,'2577428118',false,2014-06-19 16:44:09,Innovative methods to improve mental health. Examining the benefits of interactions with animals & robots. $10-$90 (203)432-8361 https://t.co/lkYFMtklpN,358,221,346,288,"New Haven, CT",53,,https://www.twitter.com/yaleiilab,https://pbs.twimg.com/profile_images/607984584559628288/knGuTWlS_normal.jpg,false,false
Harlan Krumholz,hmkyale,'73845366',false,2009-09-13 04:37:38,"Harold H. Hines Jr Professor, Yale Univ; Director, YNHH CORE; Editor-in-Chief, JACC. Working to improve the future for those who follow us...",21540,26381,1790,8903,Yale School of Medicine,3118,https://pbs.twimg.com/profile_banners/73845366/1714755012,https://www.twitter.com/hmkyale,https://pbs.twimg.com/profile_images/1786437527391350784/-g2GceUx_normal.jpg,false,false
John Kerry,JohnKerry,'15007149',false,2008-06-04 12:51:10,"Teresa's husband, 28 years representing Massachusetts in the U.S. Senate, 68th U.S. Secretary of State, now fighting the climate crisis.",2818,3213044,575,93,Proud Bostonian,786,https://pbs.twimg.com/profile_banners/15007149/1606151977,https://www.twitter.com/JohnKerry,https://pbs.twimg.com/profile_images/1205176184906092545/fI6BP6PK_normal.jpg,false,true
Eric Ries,ericries,'14278978',false,2008-04-01 19:28:19,"Trying to change how startups are built.

https://t.co/Busv1ruylX",34393,309446,1818,1241,SF,789,https://pbs.twimg.com/profile_banners/14278978/1715277232,https://www.twitter.com/ericries,https://pbs.twimg.com/profile_images/920360278650318848/QWtr0ikE_normal.jpg,false,true
AAAYA,aayalealumni,'63293032',false,2009-08-05 19:21:16,Association of Asian American Yale Alumni,861,541,177,126,,56,https://pbs.twimg.com/profile_banners/63293032/1398746553,https://www.twitter.com/aayalealumni,https://pbs.twimg.com/profile_images/1592704521578291201/zdi3_B5n_normal.jpg,false,false
@YaleEmotion,YaleEmotion,'2325962143',false,2014-02-03 14:43:26,"We use the power of emotions to create a healthier & more equitable, innovative, & compassionate society. @rulerapproach is our evidence-based approach to #SEL.",3874,18611,142,2134,New Haven CT,1153,https://pbs.twimg.com/profile_banners/2325962143/1647436193,https://www.twitter.com/YaleEmotion,https://pbs.twimg.com/profile_images/1143587211113357313/3wBcLHZC_normal.png,false,false
Yale Online,Yale_Online,'2203245666',false,2013-11-19 10:00:01,Office of Digital Dissemination & Online Education,321,740,126,24,"New Haven, CT",14,https://pbs.twimg.com/profile_banners/2203245666/1386010900,https://www.twitter.com/Yale_Online,https://pbs.twimg.com/profile_images/378800000775333668/5baa03613381ad3744533aca1c9119d0_normal.png,false,false
Yale Club South TX,YaleClubSouthTX,'493376709',false,2012-02-15 13:51:08,The YCST supports Yale alumni throughout South Texas. Check here for events/news.,736,244,69,13,"San Antonio, TX",130,https://pbs.twimg.com/profile_banners/493376709/1367978160,https://www.twitter.com/YaleClubSouthTX,https://pbs.twimg.com/profile_images/1830211925/jake_normal.jpg,false,false
Yale Class of 1993,YaleClassof1993,'952929276',false,2012-11-16 23:48:21,Connecting classmates to each other and to the rest of the world (we copied that from the '87 folks). #Y93 #YaleAlumni,2123,358,386,489,"New Haven, CT and beyond",116,https://pbs.twimg.com/profile_banners/952929276/1403496382,https://www.twitter.com/YaleClassof1993,https://pbs.twimg.com/profile_images/641294358000631808/kYhYejiq_normal.png,false,false
Feb Club Emeritus,febclub,'85449794',false,2009-10-26 19:42:26,Feb Club! A Yale Tradition. Done alumni style. You can find us on Facebook at Feb Club for Old People (our original name).,3885,845,575,275,All over the world,165,https://pbs.twimg.com/profile_banners/85449794/1548472558,https://www.twitter.com/febclub,https://pbs.twimg.com/profile_images/550067525/n10159860925_3034_normal.jpg,false,false
Morse College,MorseCollege,'1684567681',false,2013-08-19 20:44:25,The official twitter feed for Morse College,219,175,48,2,,9,https://pbs.twimg.com/profile_banners/1684567681/1382280472,https://www.twitter.com/MorseCollege,https://pbs.twimg.com/profile_images/378800000326189150/162a8d31ab0ee879b2b6fd4ed1f1e46f_normal.jpeg,false,false
Yale Class of 1987,YaleCollege1987,'428244437',false,2011-12-04 09:35:24,Connecting #Yale87 classmates to each other & the broader Yale alumni community. Tweets by volunteers.,2261,383,267,230,,115,https://pbs.twimg.com/profile_banners/428244437/1477573420,https://www.twitter.com/YaleCollege1987,https://pbs.twimg.com/profile_images/2845173724/2662e131175423cf215e12835dc52090_normal.jpeg,false,false
YaleWomen,yalewomen,'388921418',false,2011-10-11 11:21:10,Global network of Yale women alums,3441,2644,866,1134,,237,https://pbs.twimg.com/profile_banners/388921418/1711014337,https://www.twitter.com/yalewomen,https://pbs.twimg.com/profile_images/1770748381956018177/u59vbYJ1_normal.jpg,false,false
Yale Class of 1989,yale1989,'1935828794',false,2013-10-04 19:44:15,"The twitter home for Yale Class of 1989. 25th Reunion coming up May 22-25, 2014! Details at http://t.co/yh0hDDhJDz",32,128,48,0,,0,https://pbs.twimg.com/profile_banners/1935828794/1381606706,https://www.twitter.com/yale1989,https://pbs.twimg.com/profile_images/378800000586337077/5b71e4d66847c9d19587afd3a3567d3a_normal.jpeg,false,false
Yale Club of London,YaleClubLondon,'385049105',false,2011-10-04 15:44:58,The Yale Club of London - representing the alumni of Yale University in the UK.,264,506,64,280,"London, UK",53,,https://www.twitter.com/YaleClubLondon,https://pbs.twimg.com/profile_images/1572985075/Yale_Logo_normal.gif,false,false
Margie Whiteleather,margiesw,'38496000',true,2009-05-07 15:19:31,Working in content for @jselingo. Previously marcomm @ Cornell. Volunteer for Yale alumni.,5331,659,658,5629,Newsletters Get Looks:,604,https://pbs.twimg.com/profile_banners/38496000/1649537556,https://www.twitter.com/margiesw,https://pbs.twimg.com/profile_images/1513698689516191752/vvaTkwQ3_normal.jpg,false,false
J Dakota Powell,jdakotapowell,'95530351',false,2009-12-08 18:53:12,"Founder @timewavestudio, XR dev, 3D artist, martial artist | prev: XR Lab, BNW on Bway | Yale | 🧪 M Curie on Meta Quest https://t.co/jmSszqpeQg, same handle Bluesky",17175,3346,2733,49695,"New York City, London",1524,https://pbs.twimg.com/profile_banners/95530351/1695731683,https://www.twitter.com/jdakotapowell,https://pbs.twimg.com/profile_images/1535654753828540416/AoGc6qRo_normal.jpg,false,true
