name,username,userId,can_dm,created_at,bio,tweets_count,followers_count,following_count,favourites_count,location,media_count,profile_banner_url,profile_url,avatar_url,verified,blue_verified
Yale ICF,YaleICF,'2319464228',false,2014-01-30 15:11:33,Providing academic & professional support for research in financial economics @YaleSOM. #YaleICF #SOMfinfac #ICF_FinancialHistoryFriday #YaleBlockchain,3991,2091,270,2567,"New Haven, CT",1004,https://pbs.twimg.com/profile_banners/2319464228/1573678017,https://www.twitter.com/YaleICF,https://pbs.twimg.com/profile_images/1037420397917032448/zwENVZBx_normal.jpg,false,false
Yale Insights,YaleInsights,'36769917',true,2009-04-30 16:55:14,"Deepen your knowledge of business and society with expertise from @YaleSOM, the Yale School of Management. Sign up for the newsletter: https://t.co/PuFzVVRnI7",4985,6216,834,1605,"New Haven, CT",426,https://pbs.twimg.com/profile_banners/36769917/1549036846,https://www.twitter.com/YaleInsights,https://pbs.twimg.com/profile_images/877940202161000449/VTSS25h__normal.jpg,false,false
Yale Alumni,YaleAlumni,'1485527791',false,2013-06-05 13:03:40,"The official account of the Yale Alumni Association 
#YaleAlumni",20321,5845,688,19704,Worldwide,5016,https://pbs.twimg.com/profile_banners/1485527791/1685479010,https://www.twitter.com/YaleAlumni,https://pbs.twimg.com/profile_images/1678824149874081792/PigwZGAI_normal.jpg,false,false
Yale OIA,Yale_OIA,'4854756227',false,2016-01-27 15:19:28,"Yale University's Office of International Affairs supports the international activity of all schools, departments, offices, centers, and organizations at Yale.",1508,1384,355,1120,"New Haven, CT",300,https://pbs.twimg.com/profile_banners/4854756227/1468611936,https://www.twitter.com/Yale_OIA,https://pbs.twimg.com/profile_images/1164638072425918464/vWWifp6e_normal.png,false,false
Tsai Center for Innovative Thinking at Yale,TsaiCITY,'297988115',false,2011-05-13 09:31:42,We inspire students from diverse backgrounds and disciplines to seek innovative ways to solve real-world problems.,2962,2763,329,471,"New Haven, CT",1158,https://pbs.twimg.com/profile_banners/297988115/1721311634,https://www.twitter.com/TsaiCITY,https://pbs.twimg.com/profile_images/1293677651215949824/IRCYrhdg_normal.jpg,false,false
🌎Yale Center for Business and the Environment,YaleCBEY,'382783908',false,2011-09-30 13:40:12,"Our mission is to inspire, support, and accelerate the transition to a just and thriving world. Taking a break here. Talk to us on LinkedIn!",6930,4608,668,3641,"Yale University, New Haven",895,https://pbs.twimg.com/profile_banners/382783908/1431695835,https://www.twitter.com/YaleCBEY,https://pbs.twimg.com/profile_images/1677275049559052288/PyxEIbjD_normal.jpg,false,false
YCCI @ Yale SOM,YaleCCI,'121573375',false,2010-03-09 18:00:46,"Yale Center for Customer Insights (YCCI). #behavioralscience + #bigdata learning lab for #marketing, innovation & #insights leaders.",5235,2114,587,1039,New Haven,586,https://pbs.twimg.com/profile_banners/121573375/1398785368,https://www.twitter.com/YaleCCI,https://pbs.twimg.com/profile_images/1711805647933648896/n0cYxiso_normal.jpg,false,false
Harvard University,Harvard,'39585367',false,2009-05-12 16:18:09,"Official account for Harvard University. Devoted to excellence in teaching, learning, and research, and to developing leaders who make a difference globally.",50020,1685271,733,10406,"Cambridge, MA",5897,https://pbs.twimg.com/profile_banners/39585367/1715873140,https://www.twitter.com/Harvard,https://pbs.twimg.com/profile_images/875797335342817282/JO5OsmxU_normal.jpg,false,true
Stanford University,Stanford,'18036441',true,2008-12-10 20:06:56,Our mission of discovery and learning is energized by a spirit of optimism and possibility that dates to our founding.,21476,1035151,581,262,"Stanford, CA",3808,https://pbs.twimg.com/profile_banners/18036441/1698857204,https://www.twitter.com/Stanford,https://pbs.twimg.com/profile_images/875395483128049664/8z_jvdLB_normal.jpg,false,true
Princeton University,Princeton,'5694822',false,2007-05-01 17:04:01,The official account of Princeton University. In the Nation’s Service and the Service of Humanity.,49547,557143,1103,19620,"Princeton, NJ",13276,https://pbs.twimg.com/profile_banners/5694822/1736523860,https://www.twitter.com/Princeton,https://pbs.twimg.com/profile_images/1797623544408612864/sCBUar6X_normal.jpg,false,true
Columbia University,Columbia,'248795646',false,2011-02-07 13:58:59,"News, events, and ideas from Columbia University in the City of New York. Recent statements and announcements: https://t.co/fmIw8er2qP",34271,528980,695,8711,"New York, New York",6194,https://pbs.twimg.com/profile_banners/248795646/1734806968,https://www.twitter.com/Columbia,https://pbs.twimg.com/profile_images/1542819032314683392/guXo5Y-K_normal.jpg,false,true
Yale Football,yalefootball,'529530470',true,2012-03-19 12:55:46,The official Twitter account of Yale Football. 2022 and 2023 Ivy League Champs 💍 💍 . NCAA Division I FCS & Ivy League member.,5956,93635,21015,2586,"New Haven, CT",3872,https://pbs.twimg.com/profile_banners/529530470/1669220571,https://www.twitter.com/yalefootball,https://pbs.twimg.com/profile_images/1595452781858537475/IB9SewN1_normal.jpg,false,false
Penn,Penn,'24894213',true,2009-03-17 11:03:50,"Official profile for news, events and interesting updates from the University of Pennsylvania. Account managed by University Communications.",42876,219205,1139,8041,"Philadelphia, PA",11729,https://pbs.twimg.com/profile_banners/24894213/1591644174,https://www.twitter.com/Penn,https://pbs.twimg.com/profile_images/1197612145820594176/omdc0qqe_normal.jpg,false,true
Ivy League,IvyLeague,'176926525',false,2010-08-10 16:19:48,World-class academics. 92 nationally-ranked teams in 2023-24. Unmatched campus opportunities. Path to lifelong success. #UnrivaledExperience 🌿,65192,52247,1545,23549,Worldwide,19249,https://pbs.twimg.com/profile_banners/176926525/1728929419,https://www.twitter.com/IvyLeague,https://pbs.twimg.com/profile_images/1676564391158792194/obXrCbeb_normal.jpg,false,false
Cornell University,Cornell,'17369110',false,2008-11-13 12:12:07,Learning. Discovery. Engagement. Join the #Cornell conversation.,24022,405745,655,17446,"Ithaca, New York",4604,https://pbs.twimg.com/profile_banners/17369110/1733410335,https://www.twitter.com/Cornell,https://pbs.twimg.com/profile_images/1628061478392676360/VclPg22R_normal.jpg,false,true
Yale Athletics,YaleAthletics,'26266640',false,2009-03-24 12:19:13,The official Twitter account of the Yale University Bulldogs. #ThisIsYale,24094,16807,333,4724,"New Haven, CT",1778,https://pbs.twimg.com/profile_banners/26266640/1656654287,https://www.twitter.com/YaleAthletics,https://pbs.twimg.com/profile_images/1542746010576834561/xyKevUgl_normal.jpg,false,true
Yale Law School,YaleLawSch,'59226213',false,2009-07-22 15:43:24,The official account of Yale Law School.,7509,90908,168,1,"New Haven, CT",947,https://pbs.twimg.com/profile_banners/59226213/1536669784,https://www.twitter.com/YaleLawSch,https://pbs.twimg.com/profile_images/1396970337166893067/cyHvDgBR_normal.jpg,false,false
Yale Daily News,yaledailynews,'39114551',true,2009-05-10 17:23:48,The Oldest College Daily,17181,33196,498,1089,"New Haven, CT",2012,https://pbs.twimg.com/profile_banners/39114551/1721145775,https://www.twitter.com/yaledailynews,https://pbs.twimg.com/profile_images/1813276761574064128/bV8vI9pf_normal.jpg,false,false
Yale School of Public Health,YaleSPH,'86964484',false,2009-11-02 10:32:59,Linking science and society | We condemn hate and scientific misinformation. We are staying at the table to promote light and truth.,14867,23778,1747,5152,Yale School of Public Health,2443,https://pbs.twimg.com/profile_banners/86964484/1732029707,https://www.twitter.com/YaleSPH,https://pbs.twimg.com/profile_images/935256321234034690/YZN9jfbN_normal.jpg,false,false
Yale School of Medicine,YaleMed,'40047360',true,2009-05-14 13:57:53,"The official Twitter feed for Yale School of Medicine, a world-renowned center for biomedical research, education, and health care founded in 1810.",15503,162074,735,9718,"New Haven, CT",2212,https://pbs.twimg.com/profile_banners/40047360/1726758381,https://www.twitter.com/YaleMed,https://pbs.twimg.com/profile_images/1159176767623651329/psl32ghJ_normal.png,false,false
The Yale Review,yalereview,'799393170',true,2012-09-02 21:40:37,"New perspectives, enduring writing. Join a conversation 200 years in the making.",9582,12133,777,6324,"New Haven, CT",842,https://pbs.twimg.com/profile_banners/799393170/1733866321,https://www.twitter.com/yalereview,https://pbs.twimg.com/profile_images/1789814688743632896/uaB0W4Pa_normal.jpg,false,false
Samuel Moyn 🔭,samuelmoyn,'19130800',false,2009-01-17 20:01:13,"Forerunner or middler-which? “Howlingly wrong.” “Liberalism against Itself"" (2023). “I didn’t expect it to gain immediate acceptance.” Yale prof.",43677,46113,819,67685,"New Haven, CT",1373,https://pbs.twimg.com/profile_banners/19130800/1637494166,https://www.twitter.com/samuelmoyn,https://pbs.twimg.com/profile_images/1367634241903874054/Hu_Dts5J_normal.jpg,false,false
Vicky Chun,Vchun,'45636308',false,2009-06-08 14:44:34,Thomas A. Beckett Director of Athletics at Yale University,16043,3408,1234,11034,"New Haven, CT",2896,https://pbs.twimg.com/profile_banners/45636308/1700438071,https://www.twitter.com/Vchun,https://pbs.twimg.com/profile_images/1202784810302877697/XqnSBAkn_normal.jpg,false,true
The Wharton School,Wharton,'7717612',true,2007-07-25 14:12:27,"Wharton School of @Penn, the world's first collegiate business school. Advancing business, education and society at large since 1881. #TheWhartonWay",31438,310677,430,10300,Philadelphia & San Francisco,4380,https://pbs.twimg.com/profile_banners/7717612/1677689116,https://www.twitter.com/Wharton,https://pbs.twimg.com/profile_images/1630972473897521152/ejq2YSUr_normal.jpg,false,true
Massachusetts Institute of Technology (MIT),MIT,'15460048',false,2008-07-16 17:33:32,The Massachusetts Institute of Technology is a world leader in research and education. Related accounts: @MITevents @MITstudents @MIT_alumni,23572,1350460,579,1862,"Cambridge, MA",11890,https://pbs.twimg.com/profile_banners/15460048/1686066271,https://www.twitter.com/MIT,https://pbs.twimg.com/profile_images/1682086247181737984/X7hyJL3t_normal.jpg,false,true
Caltech,Caltech,'16536844',true,2008-09-30 19:23:22,"At the California Institute of Technology, extraordinary people translate big ideas into big discoveries.",10054,125680,620,12145,"Pasadena, CA",1638,https://pbs.twimg.com/profile_banners/16536844/1560877518,https://www.twitter.com/Caltech,https://pbs.twimg.com/profile_images/840360735813197825/RGKA-xsb_normal.jpg,false,false
1stGenYale,1stgenyale,'768639694972129280',false,2016-08-24 22:42:38,"Yale alumni, 1st in college/graduate school, low-income, diverse backgrounds, celebrate alumni & students sharing similar backgrounds navigate Yale and beyond.",2105,827,176,881,World,756,https://pbs.twimg.com/profile_banners/768639694972129280/1735781178,https://www.twitter.com/1stgenyale,https://pbs.twimg.com/profile_images/1019699288006447105/kDA3ogRd_normal.jpg,false,false
Dartmouth 🌲,dartmouth,'21226678',true,2009-02-18 13:46:53,An Ivy League School in a League of Its Own,22755,91837,2700,12992,"Hanover, NH",2513,https://pbs.twimg.com/profile_banners/21226678/1734463653,https://www.twitter.com/dartmouth,https://pbs.twimg.com/profile_images/997652510725885952/wp--F4Tk_normal.jpg,false,true
Peter Salovey,SaloveyPeter,'2379093779',false,2014-03-03 07:18:58,,135,1247,62,24,,4,,https://www.twitter.com/SaloveyPeter,https://pbs.twimg.com/profile_images/642862550246420480/CKwW5NPV_normal.jpg,false,false
YaleSpanPort,YaleSpanPort,'1552654115972345858',false,2022-07-28 09:56:21,Official account of the Department of Spanish and Portuguese at Yale University.,41,279,88,24,"New Haven, CT",16,https://pbs.twimg.com/profile_banners/1552654115972345858/1659017229,https://www.twitter.com/YaleSpanPort,https://pbs.twimg.com/profile_images/1552654745352818689/Yltt2LoA_normal.jpg,false,false
Joe and Clara Tsai Foundation,thejctf,'1338901669153796103',false,2020-12-15 12:40:19,"We are visionary pragmatists looking for smart, scalable solutions that create positive social impact.  #BackBlackBK",553,821,66,31,"Brooklyn, NY",13,https://pbs.twimg.com/profile_banners/1338901669153796103/1608153290,https://www.twitter.com/thejctf,https://pbs.twimg.com/profile_images/1339234057335566351/7ePSS1Oj_normal.jpg,false,false
Wu Tsai Institute | Yale University,WuTsaiYale,'1360317618796851201',false,2021-02-12 15:00:27,Our mission is to understand human cognition and explore human potential by sparking interdisciplinary inquiry. #KnowTogether,845,3371,364,2035,"New Haven, CT",142,https://pbs.twimg.com/profile_banners/1360317618796851201/1727315372,https://www.twitter.com/WuTsaiYale,https://pbs.twimg.com/profile_images/1838980784226525185/7_4DNLMq_normal.jpg,false,true
Yale Black Postdoctoral Association,YaleBPA,'1296118890565644288',false,2020-08-19 12:16:55,The official Twitter account for the @Yale Black #Postdoc Association #BlackAndSTEM,424,799,107,478,"New Haven, CT",82,https://pbs.twimg.com/profile_banners/1296118890565644288/1597854353,https://www.twitter.com/YaleBPA,https://pbs.twimg.com/profile_images/1296121212486262784/1Lz_jYB9_normal.jpg,false,false
Yale Baseball,YaleBaseball,'737845856',false,2012-08-04 22:34:59,"The Official Twitter Account of Yale Baseball. 2017 Ivy League Tournament Champions. Back to Back Regular Season Champs ('17, '18). #ThisIsYale @Yalebsbrecruit",4291,23935,270,1750,"New Haven, CT",1370,https://pbs.twimg.com/profile_banners/737845856/1656653667,https://www.twitter.com/YaleBaseball,https://pbs.twimg.com/profile_images/1542743499010764802/JYv8U9e__normal.jpg,false,false
Kerry Initiative,KerryInitiative,'893124933479432192',false,2017-08-03 11:02:32,"The Kerry Initiative at Yale is an interdisciplinary program that tackles pressing global challenges through teaching, research, and international dialogue.",144,1095,84,42,,43,https://pbs.twimg.com/profile_banners/893124933479432192/1525874233,https://www.twitter.com/KerryInitiative,https://pbs.twimg.com/profile_images/916395808479514624/UtXatDLD_normal.jpg,false,false
Yale Social and Behavioral Sciences,SBS_Yale,'1030479638471090181',false,2018-08-17 11:41:05,The Department of Social and Behavioral Sciences @YaleSPH aims to understand and improve health equity and social justice.,1063,3769,334,517,"New Haven, CT",99,https://pbs.twimg.com/profile_banners/1030479638471090181/1534520672,https://www.twitter.com/SBS_Yale,https://pbs.twimg.com/profile_images/1030480355961131009/Ztr9SPm8_normal.jpg,false,false
Jeffrey Brock,ProfJeffBrock,'792776465427394560',false,2016-10-30 13:13:33,"Dean, @YaleEngineering. William S. Massey Professor of Mathematics at @Yale. Jazz bassist, sculler, father. Tweets are my own views.",897,1448,1892,3662,"Hamden, CT",31,https://pbs.twimg.com/profile_banners/792776465427394560/1616512026,https://www.twitter.com/ProfJeffBrock,https://pbs.twimg.com/profile_images/792781721372651520/71xgc4re_normal.jpg,false,false
Yale Women’s Basketball,YaleWBasketball,'366237769',false,2011-09-01 16:33:06,The official Twitter account of Yale Women's Basketball. NCAA Division I & Ivy League Member. #ThisIsYale,8180,12241,384,1518,"New Haven, CT",3823,https://pbs.twimg.com/profile_banners/366237769/1656654793,https://www.twitter.com/YaleWBasketball,https://pbs.twimg.com/profile_images/1542748124996726784/oAYtCTpo_normal.jpg,false,false
Yale Env Humanities,YaleEnvHum,'857277629862424576',false,2017-04-26 12:58:09,"Teaching, scholarship, and action at the intersection of the environment and the humanities",848,2943,123,68,,182,https://pbs.twimg.com/profile_banners/857277629862424576/1503665303,https://www.twitter.com/YaleEnvHum,https://pbs.twimg.com/profile_images/901047833293455360/Pkdo1Y_C_normal.jpg,false,false
Yale Data Science,yaledatascience,'782022614785093632',true,2016-09-30 21:01:35,Yale Data Science,515,2184,170,405,"New Haven, CT",123,https://pbs.twimg.com/profile_banners/782022614785093632/1697135967,https://www.twitter.com/yaledatascience,https://pbs.twimg.com/profile_images/1712537833187983361/bYoqIrX3_normal.jpg,false,false
Yale Health Policy & Management,YaleHPM,'880145595134029824',false,2017-06-28 15:27:17,"Department of Health Policy and Management, Yale School of Public Health, @yalesph. (Tweets by @jasonlschwartz)",434,1154,101,368,"New Haven, CT",17,https://pbs.twimg.com/profile_banners/880145595134029824/1498679429,https://www.twitter.com/YaleHPM,https://pbs.twimg.com/profile_images/880147328459472897/2gM2xNeB_normal.jpg,false,false
infonewhaven,InfoNewHaven,'122140272',false,2010-03-11 13:38:23,"Official tourism account for Downtown New Haven, CT. Everything you need to know about dining, shopping, events & culture in the Elm City. #NHV",8637,6725,1102,5770,"New Haven, CT",2912,https://pbs.twimg.com/profile_banners/122140272/1727359386,https://www.twitter.com/InfoNewHaven,https://pbs.twimg.com/profile_images/1825612754373242880/LnSCO4yP_normal.jpg,false,false
Yale Surgery,YaleSurgery,'839936975125819399',false,2017-03-09 15:32:35,The official account for the Yale School of Medicine Department of Surgery.,1180,4258,216,438,"New Haven, CT",246,https://pbs.twimg.com/profile_banners/839936975125819399/1679077521,https://www.twitter.com/YaleSurgery,https://pbs.twimg.com/profile_images/1159535967558131714/BAzMmQKv_normal.jpg,false,false
Yale Hacking Health,YaleHackHealth,'4144754973',false,2015-11-08 17:23:47,"Yale CBIT annual Healthcare Hackathon, January 22-24 2021 hosted by @YaleCBIT",450,627,268,120,"New Haven, CT",210,https://pbs.twimg.com/profile_banners/4144754973/1542828752,https://www.twitter.com/YaleHackHealth,https://pbs.twimg.com/profile_images/1058106833506889728/wzcjP3KK_normal.jpg,false,false
Yale DHLab,YaleDHLab,'3226835529',true,2015-05-01 16:15:47,"Space, community, and resources to support #digitalhumanities @yalelibrary. Office Hours resume late spring 2023 in Sterling Memorial Library.",495,1611,206,828,"New Haven, CT",105,https://pbs.twimg.com/profile_banners/3226835529/1539875105,https://www.twitter.com/YaleDHLab,https://pbs.twimg.com/profile_images/673907521313234944/WmuM7gbC_normal.png,false,false
CHIRAL,Yale_CHIRAL,'740893391953788932',false,2016-06-09 09:08:44,Improving the quality of patient care transitions across the health continuum @YaleMed and @YNHH with critical @AHRQ support.,343,169,80,23,,10,https://pbs.twimg.com/profile_banners/740893391953788932/1487092429,https://www.twitter.com/Yale_CHIRAL,https://pbs.twimg.com/profile_images/831551850340048897/v5Er6zCe_normal.jpg,false,false
Moira Fitzgerald,moira_ann,'10247762',false,2007-11-14 09:44:40,"Head of Access Services, Beinecke Rare Book & Manuscript Library, Yale University",431,421,456,11045,,82,https://pbs.twimg.com/profile_banners/10247762/1491693176,https://www.twitter.com/moira_ann,https://pbs.twimg.com/profile_images/914276327792025600/V4vYY9eS_normal.jpg,false,false
Lloyd Grieger,LloydGrieger,'701113575251685376',false,2016-02-20 13:37:57,,326,369,218,582,,28,https://pbs.twimg.com/profile_banners/701113575251685376/1463448140,https://www.twitter.com/LloydGrieger,https://pbs.twimg.com/profile_images/722647719441997824/TnWq_7v__normal.jpg,false,false
AFRICA SALON UK,africasalon,'4916783482',false,2016-02-15 19:43:29,🏴 global contemporary African arts festival ➿ Vivid Escapisms for an Interior 7/25 ◼️ not to be confused with the not-for-profit Yale Africa Salon,117,316,47,124,London,6,https://pbs.twimg.com/profile_banners/4916783482/1568657013,https://www.twitter.com/africasalon,https://pbs.twimg.com/profile_images/826390667811291137/ohaWQ9CA_normal.jpg,false,false
Edward A. Snyder,EdwardASnyder,'4898869396',false,2016-02-11 13:28:39,"Professor Economics and Management - Yale School of Management.
Socially liberal, free-market economist who focuses on global issues.",228,1067,254,526,"New Haven, CT",33,https://pbs.twimg.com/profile_banners/4898869396/1455219413,https://www.twitter.com/EdwardASnyder,https://pbs.twimg.com/profile_images/697853888460951553/NFAareVe_normal.jpg,false,false
Mark Gerstein,MarkGerstein,'230944453',false,2010-12-26 23:31:33,"#Bioinformatics professor, interested in #DataScience, with photography, triathlons & non-fiction books as hobbies",6557,7979,875,2092,Yale,316,,https://www.twitter.com/MarkGerstein,https://pbs.twimg.com/profile_images/378800000232600610/b3683cc9f226a8173d08e6041cdee6ff_normal.jpeg,false,false
Stefan Simon 🇪🇺🇺🇸 @318 ppm CO2,mcsts,'75975649',false,2009-09-21 02:57:51,"Heritage scientist. Director Rathgen Research Laboratory. 💚 Fulbright Canada Distinguished Chair in Arts and Social Sciences, Carleton University, Ottawa,ON",6513,1948,1754,25840,Berlin - Olching - Houston ,1004,https://pbs.twimg.com/profile_banners/75975649/1684267027,https://www.twitter.com/mcsts,https://pbs.twimg.com/profile_images/1512525825425518595/ZEps1Kqh_normal.jpg,false,false
Robert J Shiller,RobertJShiller,'583938358',false,2012-05-18 12:06:44,Economist at Yale University. Irrationally Exuberant.,276,189226,57,6,New Haven CT,10,https://pbs.twimg.com/profile_banners/583938358/1557257483,https://www.twitter.com/RobertJShiller,https://pbs.twimg.com/profile_images/378800000673579465/2b50ca97d43b1c4a53597accaa2dae5f_normal.jpeg,false,true
Schwarzman Scholars,SchwarzmanOrg,'1365244806',false,2013-04-19 15:52:02,"🎓 Fully-funded one-year master's program in Global Affairs
📍 Schwarzman College, Tsinghua University in Beijing, China
💡 Shape the future",2632,19508,574,386,,839,https://pbs.twimg.com/profile_banners/1365244806/1689288827,https://www.twitter.com/SchwarzmanOrg,https://pbs.twimg.com/profile_images/1679625189951262720/t0pVlMOA_normal.png,false,false
YMSC,YaleCollection,'621148893',false,2012-06-28 11:17:28,"The Morris Steinert Collection of Musical Instruments at Yale is currently closed to the public, but open for fun facts about musical instruments!",130,143,39,17,"New Haven, CT",10,https://pbs.twimg.com/profile_banners/621148893/1437073460,https://www.twitter.com/YaleCollection,https://pbs.twimg.com/profile_images/2349347507/collection_normal.jpg,false,false
YaleEnviroSustSummit,YESS_2015,'2829823953',false,2014-10-14 12:48:38,"The official Twitter account of the Yale Environmental Sustainability Summit, taking place at @YaleFES and @YaleSOM on Nov. 6-7th, 2015. #YESS_2015",926,378,356,91,"New Haven, CT",61,https://pbs.twimg.com/profile_banners/2829823953/1413307741,https://www.twitter.com/YESS_2015,https://pbs.twimg.com/profile_images/595022471792820225/Gm0_5jPa_normal.jpg,false,false
Yale Young African Scholars,YaleYoungAfrica,'2471170057',false,2014-04-30 11:37:29,"YYAS is a transformative academic enrichment and leadership program for secondary school students from across the African continent 🌍🎓

Apply Now!",564,2304,661,261,,202,https://pbs.twimg.com/profile_banners/2471170057/1583768932,https://www.twitter.com/YaleYoungAfrica,https://pbs.twimg.com/profile_images/1443954993963352097/VfWa5Gg5_normal.jpg,false,false
Yale Poorvu Center,PoorvuCenter,'3845360541',false,2015-10-02 14:53:43,✨ Celebrating 10 Years | 🏛️ Empowering Teaching & Learning at Yale | 🤝 Promoting Equity & Engagement | 🎓 Helping Students Own Their Journey #PoorvuProud,636,1520,318,579,"New Haven, CT",173,https://pbs.twimg.com/profile_banners/3845360541/1700689293,https://www.twitter.com/PoorvuCenter,https://pbs.twimg.com/profile_images/1838247004402495488/RM6eX7Uo_normal.jpg,false,false
Yale Faculty,YaleFaculty,'3293429650',false,2015-05-21 17:35:19,"Yale faculty news, views, and resources | Faculty Development and Diversity | Office of the Provost",2634,1308,176,39,"New Haven, CT",44,https://pbs.twimg.com/profile_banners/3293429650/1523898028,https://www.twitter.com/YaleFaculty,https://pbs.twimg.com/profile_images/766718849005780992/3Gm9mctB_normal.jpg,false,false
YaleCtrResearchComp,YaleCRC,'3108338495',false,2015-03-23 15:13:39,The Yale Center for Research Computing will enhance the level of computational support provided to researchers.,2763,535,294,234,"New Haven, CT",140,https://pbs.twimg.com/profile_banners/3108338495/1525455447,https://www.twitter.com/YaleCRC,https://pbs.twimg.com/profile_images/588098323615191041/aq8oYR_4_normal.png,false,false
Yale LGBTQ Resources,YaleLGBTQ,'599361515',false,2012-06-04 12:14:45,"News, events and updates from the Yale University Office of LGBTQ Resources.",332,1021,233,122,"Founders Hall, 135 Prospect St, Yale University, New Haven, CT",114,https://pbs.twimg.com/profile_banners/599361515/1658433863,https://www.twitter.com/YaleLGBTQ,https://pbs.twimg.com/profile_images/1550210039197081600/7y008qzR_normal.jpg,false,false
Enviro Film Festival,Yale_EFFY,'242070266',false,2011-01-23 16:39:14,"The Environmental Film Festival at @Yale: April 4-7, 2018. EFFY is the premier student-run festival for environmental films. Free & open to everyone! #EFFY2018",1460,1032,2010,740,"New Haven, CT",289,https://pbs.twimg.com/profile_banners/242070266/1475019465,https://www.twitter.com/Yale_EFFY,https://pbs.twimg.com/profile_images/780916678716628992/r41A7Fpk_normal.jpg,false,false
Yale Lux,YaleLux,'3004930726',false,2015-01-29 22:59:45,A lighting and projection exhibition debuting in April 2015 celebrating the diversity of academic and artistic excellence at Yale.,93,164,45,36,"New Haven, CT",43,https://pbs.twimg.com/profile_banners/3004930726/1422595248,https://www.twitter.com/YaleLux,https://pbs.twimg.com/profile_images/561232318187044864/XpPpxTe1_normal.png,false,false
