name,username,userId,can_dm,created_at,bio,tweets_count,followers_count,following_count,favourites_count,location,media_count,profile_banner_url,profile_url,avatar_url,verified,blue_verified
Yale Women's Tennis,YaleWTennis,'97335561',false,2009-12-16 20:48:43,The official Twitter account of Yale Women's Tennis. NCAA Division I & Ivy League member. #ThisIsYale,5343,1102,229,92,"New Haven, CT",604,https://pbs.twimg.com/profile_banners/97335561/1656653424,https://www.twitter.com/YaleWTennis,https://pbs.twimg.com/profile_images/1542742347292631040/ie9YMvRX_normal.jpg,false,false
Yale Spizzwinks(?),spizzwink,'76772573',false,2009-09-23 18:10:51,"Students by day, singers by night! Est. 1914, America's oldest underclassman a cappella group. Find us on FB and Instagram (@spizzwink). 

We Ride(?)",1466,886,103,794,"New Haven, CT",400,https://pbs.twimg.com/profile_banners/76772573/1687032640,https://www.twitter.com/spizzwink,https://pbs.twimg.com/profile_images/635884880140734465/bKVNgdtZ_normal.png,false,false
Yale DMCA,yaledmca,'21756339',false,2009-02-24 09:10:06,The Yale University Digital Media Center for the Arts provides instruction and resources for digital projects to Arts area departments and facilities at Yale.,296,428,21,1,"149 York St, New Haven, CT",6,,https://www.twitter.com/yaledmca,https://pbs.twimg.com/profile_images/83272666/D_normal.jpg,false,false
YaleYDC2,YaleYDC2,'48997452',false,2009-06-20 08:46:16,"Yale Digital Collections Center on West Campus provides expertise and facilities for the creation, management, and use of digital cultural heritage.",100,261,36,0,"Yale University, New Haven, CT",0,,https://www.twitter.com/YaleYDC2,https://pbs.twimg.com/profile_images/2167203877/venn_diagram_normal.png,false,false
The Yale Club of NYC,YaleClubNYC,'38190367',false,2009-05-06 10:38:25,"A home away from home for Yale alumni. Three restaurants, 138 hotel rooms, gym, and special events bring alumni of all generations together.",1443,3085,435,237,"50 Vanderbilt Avenue, NY, NY",563,https://pbs.twimg.com/profile_banners/38190367/1624315369,https://www.twitter.com/YaleClubNYC,https://pbs.twimg.com/profile_images/923621473117491205/neBxDkBP_normal.jpg,false,false
The Whiffenpoofs,whiffenpoofs,'24180185',false,2009-03-13 10:35:32,America’s Oldest Collegiate A Cappella Group | Est. 1909,1493,2207,97,440,"New Haven, CT",588,https://pbs.twimg.com/profile_banners/24180185/1612893412,https://www.twitter.com/whiffenpoofs,https://pbs.twimg.com/profile_images/1233477967839465478/PI8w6zdJ_normal.jpg,false,false
Yale Law Admissions,ylsadmissions,'48766856',false,2009-06-19 13:22:37,The Office of Admissions at Yale Law School,720,4045,45,150,"New Haven, CT",68,https://pbs.twimg.com/profile_banners/48766856/1570558547,https://www.twitter.com/ylsadmissions,https://pbs.twimg.com/profile_images/921425658408038400/lk0mjwDD_normal.jpg,false,false
Yale Club of Japan,YaleClubofJapan,'318840646',false,2011-06-17 00:04:31,The #Yale Club of Japan brings together @Yale alumni residing and stopping by in Japan to meet one another and maintain their connection with the University.,592,327,260,28,"Tokyo, Japan",60,,https://www.twitter.com/YaleClubofJapan,https://pbs.twimg.com/profile_images/1399649992/yalejapan_normal.JPG,false,false
Yale SOM Alumni,YaleSOMAlumni,'228757768',false,2010-12-20 11:02:10,This account is managed by the Office of Alumni Relations at the Yale School of Management. Include #YaleSOMAlumni in your tweets to be featured here!,2205,2437,446,324,"New Haven, CT, USA",363,https://pbs.twimg.com/profile_banners/228757768/1637011463,https://www.twitter.com/YaleSOMAlumni,https://pbs.twimg.com/profile_images/1045300682063065088/OAYnwuSv_normal.jpg,false,false
Whiffenpoofs of Yale,Whiffenpoofs100,'58878013',false,2009-07-21 14:39:19,The world's oldest and best-known collegiate a cappella group!,41,564,79,0,"New Haven, CT",0,,https://www.twitter.com/Whiffenpoofs100,https://pbs.twimg.com/profile_images/445396498/twitter_icon_normal.gif,false,false
YalePublishingCourse,YalePubCourse,'145725636',false,2010-05-19 14:26:35,"An intensive week-long program at Yale University dedicated to helping publishing professionals lead in an increasingly global, digital environment.",1074,911,529,520,"New Haven, CT, USA",66,https://pbs.twimg.com/profile_banners/145725636/1415292602,https://www.twitter.com/YalePubCourse,https://pbs.twimg.com/profile_images/671698880497520641/obENkfGl_normal.jpg,false,false
Yale Law & Tech,yalelawtech,'70520724',false,2009-08-31 18:33:07,CPSC 183 & 185 courses at Yale taught by Brad Rosen (@drabsnore),1322,2781,256,1,"New Haven, CT",27,,https://www.twitter.com/yalelawtech,https://pbs.twimg.com/profile_images/394024350/yalelogo_normal.png,false,false
Yale Journal,YaleJournal,'80723349',false,2009-10-07 20:45:10,"The Yale Journal of International Affairs publishes the best student and practitioner foreign policy analysis. Essays, op-eds, book reviews, and photo essays.",701,3034,1485,165,"New Haven, CT",70,https://pbs.twimg.com/profile_banners/80723349/1477881799,https://www.twitter.com/YaleJournal,https://pbs.twimg.com/profile_images/1794122663100600321/7K13A-Bt_normal.jpg,false,false
Dr. Elizabeth Alexander,ProfessorEA,'452218563',false,2012-01-01 10:33:04,"Poet, scholar, educator. President @MellonFdn. Author of THE TRAYVON GENERATION and THE LIGHT OF THE WORLD. Co-worker in the kingdom of culture. Views my own.",6052,20161,681,8408,"New York, NY",134,https://pbs.twimg.com/profile_banners/452218563/1444219523,https://www.twitter.com/ProfessorEA,https://pbs.twimg.com/profile_images/1511375264957272067/fqqtR8Ji_normal.jpg,false,false
Dean Karlan,deankarlan,'201295507',true,2010-10-11 10:55:58,"Economics and Finance Professor, Northwestern University; Chief Economist, USAID",2194,20072,118,217,"Evanston, IL",30,https://pbs.twimg.com/profile_banners/201295507/1378472329,https://www.twitter.com/deankarlan,https://pbs.twimg.com/profile_images/378800000419163303/71643fd9fcab722d47755a208a262c3c_normal.jpeg,false,false
Yale Men's Basketball,YaleMBasketball,'349116915',true,2011-08-05 11:40:01,"The official Twitter of Yale Men's Basketball. 2015, 2016, 2019, 2020, 2022, 2023 & 2024 Ivy League Champions. DEFEND, REBOUND, SHARE. #ThisIsYale",11712,12525,350,3396,"New Haven, Conn.",3121,https://pbs.twimg.com/profile_banners/349116915/1656653947,https://www.twitter.com/YaleMBasketball,https://pbs.twimg.com/profile_images/1542744543988109312/PbErBDqp_normal.jpg,false,false
Yale Green Chemistry,YaleGreenChem,'130515813',false,2010-04-07 10:24:15,Center for Green Chemistry and Green Engineering at Yale University,1072,5439,451,788,"New Haven, CT, USA",148,https://pbs.twimg.com/profile_banners/130515813/1591892925,https://www.twitter.com/YaleGreenChem,https://pbs.twimg.com/profile_images/1154818187575353344/LdgjOuA7_normal.jpg,false,true
Climate Connections,CC_Yale,'31439308',false,2009-04-15 11:54:06,"Daily radio programming and original reporting, commentary, and analysis on climate change. Re-tweets are not necessarily endorsements.",9750,21044,870,235,U.S.,2476,https://pbs.twimg.com/profile_banners/31439308/1643307444,https://www.twitter.com/CC_Yale,https://pbs.twimg.com/profile_images/1267947897410248704/NLjENuhu_normal.jpg,false,false
Yale University Press London📚,YaleBooks,'214055102',false,2010-11-10 08:10:35,"Book news for the UK & outside the US from Yale University Press in London
& @YalePevsner & @LittleHistoryof & @YUPL_Publicity
Find YaleUP US tweets @yalepress",19597,15069,7257,8221,London,6082,https://pbs.twimg.com/profile_banners/214055102/1734950018,https://www.twitter.com/YaleBooks,https://pbs.twimg.com/profile_images/1673985642026487809/2CTPJmn4_normal.jpg,false,false
Helen E. Dodson,HDodsonMedComm,'18122243',false,2008-12-14 15:33:29,"Assistant Dean and Director of Communications and Outreach, American University College of Arts and Sciences",135,274,141,23,"Washington, DC",0,,https://www.twitter.com/HDodsonMedComm,https://pbs.twimg.com/profile_images/909578059057070080/xxYAAJr3_normal.jpg,false,false
Kianti Roman,KRomanYale,'334226829',false,2011-07-12 15:28:32,"Communications Officer, Yale University",63,105,46,3,Yale University,0,,https://www.twitter.com/KRomanYale,https://pbs.twimg.com/profile_images/1440461957/215695_1023092574347_1136209567_81047_5748_n__1__normal.jpg,false,false
Elizabeth Stauderman,elista,'20269174',false,2009-02-06 15:34:28,"Cockeyed optimist. Repentant cynic. Words, design, clarity, charity, counterpoint, big ideas, wretched dogs, thoughtful execution.",847,240,276,1181,"Saratoga Springs, NY",88,https://pbs.twimg.com/profile_banners/20269174/1400515533,https://www.twitter.com/elista,https://pbs.twimg.com/profile_images/1316104261/photo_normal.jpg,false,false
Michael Morand,MimoCT,'9954032',false,2007-11-04 21:35:22,"Child of God, follower of Jesus, 🇺🇸citizen ❤️ #NHV 🇬🇭 @beineckelibrary @yale etc. Witness insistence faith. Things here just me.",58858,3237,614,1393,"New Haven, CT",5609,https://pbs.twimg.com/profile_banners/9954032/1588854917,https://www.twitter.com/MimoCT,https://pbs.twimg.com/profile_images/1377601035712270337/6JJLe356_normal.jpg,false,false
Yale Jackson School,JacksonYale,'267879894',false,2011-03-17 14:33:07,Inspiring and preparing Yale students for global citizenship and leadership.,2161,6421,313,1217,"New Haven, CT",801,https://pbs.twimg.com/profile_banners/267879894/1684849415,https://www.twitter.com/JacksonYale,https://pbs.twimg.com/profile_images/1661002584033771521/t8vg0hX__normal.jpg,false,false
Yale Center for Environmental Law & Policy,YaleCELP,'263736435',false,2011-03-10 11:56:08,Advancing fresh thinking and analytically rigorous approaches to environmental decision-making.,14002,8185,3563,8153,"New Haven, CT, USA",928,https://pbs.twimg.com/profile_banners/263736435/1721748167,https://www.twitter.com/YaleCELP,https://pbs.twimg.com/profile_images/1815773379216941058/fBkAfCdz_normal.jpg,false,false
Robert B. Haas Family Arts Library,YaleHaasArtsLib,'125744575',false,2010-03-23 14:48:35,"The Robert B. Haas Family Arts Library @yalelibrary specializes in visual arts, art history, design, architecture, drama, and art-related special collections.",1924,725,184,313,"New Haven, CT",200,https://pbs.twimg.com/profile_banners/125744575/1382972366,https://www.twitter.com/YaleHaasArtsLib,https://pbs.twimg.com/profile_images/770757977/HaasCircDesk_normal.jpg,false,false
STAY at Yale,STAYatYale,'465873563',false,2012-01-16 15:40:18,"STAY is a Yale organization that brings together undergrads, grad & prof. school students, and alumni through service, mentorship, & social activities.",80,341,261,22,"New Haven, CT",16,https://pbs.twimg.com/profile_banners/465873563/1400252153,https://www.twitter.com/STAYatYale,https://pbs.twimg.com/profile_images/1760238719/handsome-dan-stay_normal.jpg,false,false
New Haven Register,nhregister,'34956062',false,2009-04-24 11:38:22,"Covering Greater New Haven since 1812.
Facebook: https://t.co/5NiFKpduIg
Newsletters: https://t.co/qZjNCAxcYb
Subscribe: https://t.co/s3b5ZmHWCA",156095,75737,5336,1085,"New Haven, Connecticut",11735,https://pbs.twimg.com/profile_banners/34956062/1617027823,https://www.twitter.com/nhregister,https://pbs.twimg.com/profile_images/1376540576087166980/5685Y8zb_normal.jpg,false,false
Yale Heavyweight Crew,YaleHWTCrew,'108454193',false,2010-01-25 19:36:43,"Official Twitter of Yale Heavyweight Crew, America's oldest collegiate team. 2017, 2018, & 2019 NATIONAL CHAMPIONS. #ThisIsYale",2049,3888,217,1409,"New Haven, CT",514,https://pbs.twimg.com/profile_banners/108454193/1656654096,https://www.twitter.com/YaleHWTCrew,https://pbs.twimg.com/profile_images/1542745162488524801/ODJPuRly_normal.jpg,false,false
Af-Am Studies,YALEAFAMstudies,'212292139',false,2010-11-05 13:33:36,"The African American Studies Department at Yale University

(Image: Kerry James Marshall, Untitled, 2009)",6061,8949,1401,5024,"New Haven, CT",321,https://pbs.twimg.com/profile_banners/212292139/1543242149,https://www.twitter.com/YALEAFAMstudies,https://pbs.twimg.com/profile_images/1160395544/copyofkm09001web-1725dbdc50a229b_normal.jpg,false,false
YCDC,DyslexiaYale,'385585813',false,2011-10-05 15:18:55,The Yale Center for Dyslexia & Creativity serves as a nexus for research and policy on dyslexia.,701,13425,78,10,"New Haven, CT",46,,https://www.twitter.com/DyslexiaYale,https://pbs.twimg.com/profile_images/1585296422/YCDClogotwitter_normal.png,false,false
Eric Gershon,Gershonicus,'430148484',false,2011-12-06 15:34:08,I see your semicolon  —  and raise you an em dash,4940,626,1215,10924,NHV,482,https://pbs.twimg.com/profile_banners/430148484/1678077899,https://www.twitter.com/Gershonicus,https://pbs.twimg.com/profile_images/1512883022936383494/JoeAGhhD_normal.jpg,false,false
Yale Health Center,yalehealth,'244214539',false,2011-01-28 15:08:54,"Providing outstanding, compassionate, patient-centered care to the Yale community. Acute Care | (203) 432-0123 Student Health | (203) 432-0312",418,731,67,70,"55 Lock Street, New Haven, CT",78,https://pbs.twimg.com/profile_banners/244214539/1699038523,https://www.twitter.com/yalehealth,https://pbs.twimg.com/profile_images/1631668301125279744/C-1ePrWA_normal.jpg,false,false
WhyIsThereAnything,YAnything,'375869998',false,2011-09-18 17:51:11,"Logos, & the “why” of the universe is a transdisciplinary inquiry into the origins & meaning of the cosmos. Conference Oct. 6-9 Sponsored by Yale Divinity",20,56,11,0,New Haven,0,,https://www.twitter.com/YAnything,https://pbs.twimg.com/profile_images/1549100103/WITA-Logo-FB_normal.jpg,false,false
YalePhysicsDept,YalePhysicsDept,'343487516',false,2011-07-27 13:07:12,The Dept. of Physics at Yale Univ. works to answer fundamental scientific questions that are pushing the frontiers of our current understanding of the universe.,2270,2793,66,65,"New Haven, CT",438,https://pbs.twimg.com/profile_banners/343487516/1642171215,https://www.twitter.com/YalePhysicsDept,https://pbs.twimg.com/profile_images/1481999536830791680/lp2OMne0_normal.jpg,false,false
FCC2015,FCC2015,'377740984',false,2011-09-21 21:33:28,,25,35,17,0,"New Haven, CT",1,,https://www.twitter.com/FCC2015,https://pbs.twimg.com/profile_images/1554007937/yalefcc_normal.jpg,false,false
HHMI,HHMINEWS,'43199901',true,2009-05-28 17:24:13,"HHMI believes in the power to advance science through research/science ed., making discoveries that benefit all. https://t.co/DqdQt2G6ca",13482,51944,4607,9636,"Chevy Chase, MD",1723,https://pbs.twimg.com/profile_banners/43199901/1726090955,https://www.twitter.com/HHMINEWS,https://pbs.twimg.com/profile_images/1833985951967645696/hwaJYLAo_normal.jpg,false,true
Yale Psychiatry,YalePsych,'274113269',false,2011-03-29 15:13:59,"The Yale Department of Psychiatry is a world leader in patient care, research, and education.",7948,31309,732,2256,"New Haven, CT",1714,https://pbs.twimg.com/profile_banners/274113269/1583245369,https://www.twitter.com/YalePsych,https://pbs.twimg.com/profile_images/918537907693961216/HHl5ytfw_normal.jpg,false,false
Connecticut Open,connecticutopen,'205533864',false,2010-10-20 22:37:29,The Connecticut Open is a WTA event that is part of the US Open Series | #CTOpenTennis,3686,7829,406,3017,"New Haven, CT",1428,https://pbs.twimg.com/profile_banners/205533864/1536334400,https://www.twitter.com/connecticutopen,https://pbs.twimg.com/profile_images/956206443438460928/2hezXgAa_normal.jpg,false,false
CIRA at Yale Univ.,CIRAatYale,'186183340',false,2010-09-02 15:53:47,The Center for Interdisciplinary Research on AIDS is 100% supported through grant No. P30MH062294 from the National Institute of Mental Health.,1433,920,326,3206,"New Haven, CT",182,https://pbs.twimg.com/profile_banners/186183340/1675977598,https://www.twitter.com/CIRAatYale,https://pbs.twimg.com/profile_images/1400307056/logo_ciramark_normal.jpg,false,false
YLSAA,YLSAA,'65113615',false,2009-08-12 14:22:06,"We are a volunteer-based organization of Yale alumni with interests in life sciences, healthcare, and pharmaceuticals. Tweets by @huangjulie + others.",321,231,153,0,Global,13,,https://www.twitter.com/YLSAA,https://pbs.twimg.com/profile_images/362133443/Revised_LOGO_normal.png,false,false
TED Talks,TEDTalks,'15492359',false,2008-07-19 09:22:50,TED is a nonprofit devoted to the ideas shaping tomorrow. 🔴 Support our mission by becoming a TED Member: https://t.co/kMHLEIyXAf,43121,10952183,674,7540,"New York, NY",7926,https://pbs.twimg.com/profile_banners/15492359/1685998279,https://www.twitter.com/TEDTalks,https://pbs.twimg.com/profile_images/877631054525472768/Xp5FAPD5_normal.jpg,false,true
Arts & Ideas,ArtIdea,'36955678',false,2009-05-01 10:40:37,"The International Festival of Arts & Ideas celebrates and builds community, engages with vital issues, and promotes the arts.",4355,5112,1126,2207,"New Haven, CT",1390,https://pbs.twimg.com/profile_banners/36955678/1736561392,https://www.twitter.com/ArtIdea,https://pbs.twimg.com/profile_images/674960327054860288/4T_enlYp_normal.png,false,false
OpenStudy,OpenStudy,'17501654',false,2008-11-19 21:02:38,The world is our study group. Join us! #WhyStudyAlone?,7708,3644,3475,1040,,596,https://pbs.twimg.com/profile_banners/17501654/1400632490,https://www.twitter.com/OpenStudy,https://pbs.twimg.com/profile_images/591684213209899008/HepdwFww_normal.png,false,false
Slifka Center,SlifkaCenter,'52714697',false,2009-07-01 08:44:38,The Center for Jewish Life @Yale,936,527,434,102,"New Haven, CT",21,https://pbs.twimg.com/profile_banners/52714697/1564765499,https://www.twitter.com/SlifkaCenter,https://pbs.twimg.com/profile_images/1157336499987406850/NgxLpCp3_normal.jpg,false,false
Yale Sustainability,YaleSustain,'108669470',false,2010-01-26 12:50:05,We strive to enhance the culture of sustainability at Yale & to develop institutional sustainability models and partnerships in New Haven and around the world.,2897,9744,763,183,"New Haven, CT",451,https://pbs.twimg.com/profile_banners/108669470/1579122033,https://www.twitter.com/YaleSustain,https://pbs.twimg.com/profile_images/1217553467646136320/MWT2bGZX_normal.jpg,false,false
LocalScale,localscale,'20214495',false,2009-02-05 22:28:07,The orchestration and acceleration platform for impact-positive initiatives.,263,575791,57331,4515,"San Francisco, California",92,https://pbs.twimg.com/profile_banners/20214495/1634640876,https://www.twitter.com/localscale,https://pbs.twimg.com/profile_images/1339424558076465154/C2G8kQBA_normal.jpg,false,true
nature,Nature,'15862891',true,2008-08-15 09:39:58,"Research, News, and Commentary from Nature, the international science journal
For daily science news, get Nature Briefing: https://t.co/wGmQlQ8a4D",81274,2598093,3364,2083,Worldwide,21243,https://pbs.twimg.com/profile_banners/15862891/1621000867,https://www.twitter.com/Nature,https://pbs.twimg.com/profile_images/1808863282091991040/EzGcmXyr_normal.jpg,false,true
NPR,NPR,'5392522',false,2007-04-22 01:10:15,NPR is an independent news organization committed to informing the public about the world around us. You can find us every other place you read the news.,244266,8380249,59185,2518,,11291,https://pbs.twimg.com/profile_banners/5392522/1680802449,https://www.twitter.com/NPR,https://pbs.twimg.com/profile_images/1419704144026296333/ms3D5ipo_normal.jpg,false,true
Wesleyan University,wesleyan_u,'26759755',false,2009-03-26 10:25:43,"Founded in 1831, we are a diverse, energetic, liberal arts community, enrolling approximately 3,000 undergraduate and 200 graduate students.",11333,21833,305,2042,"Middletown, Connecticut",3068,https://pbs.twimg.com/profile_banners/26759755/1604001748,https://www.twitter.com/wesleyan_u,https://pbs.twimg.com/profile_images/1617602313534771215/ASh0Aft6_normal.jpg,false,false
Brown University,BrownUniversity,'14884486',false,2008-05-23 13:57:42,Official X feed for Brown University. 🐻,31089,239314,614,29771,"Providence, Rhode Island",3806,https://pbs.twimg.com/profile_banners/14884486/1654720807,https://www.twitter.com/BrownUniversity,https://pbs.twimg.com/profile_images/1447976566433189892/bms8GwG__normal.jpg,false,true
Yale.NYC,YaleAlumAssocNY,'110880014',false,2010-02-02 21:24:40,"https://t.co/qvUzAU1nNc is THE alumni organization for New York City and Long Island, serving a community of 17,000 Yale University alumni in the region.",3549,1687,185,890,"New York, NY",113,https://pbs.twimg.com/profile_banners/110880014/1549899788,https://www.twitter.com/YaleAlumAssocNY,https://pbs.twimg.com/profile_images/1094985189317582851/FJe-BW8i_normal.jpg,false,false
The Shops at Yale,TheShopsatYale,'46686567',false,2009-06-12 12:20:55,"An open-air shopping experience with local boutiques, national retailers and a variety of restaurants. https://t.co/Bq8BLEgAhH",4780,2973,500,1143,"Downtown New Haven, CT",2257,https://pbs.twimg.com/profile_banners/46686567/1673034215,https://www.twitter.com/TheShopsatYale,https://pbs.twimg.com/profile_images/1544352662161874952/U3iardMM_normal.jpg,false,false
New Haven Cultural,newhavecultural,'19662710',false,2009-01-28 12:14:55,"New Haven Department of Arts, Culture and Tourism, New Haven events, activities",7422,6378,281,277,"New Haven, Connecticut",767,https://pbs.twimg.com/profile_banners/19662710/1684509375,https://www.twitter.com/newhavecultural,https://pbs.twimg.com/profile_images/2579637925/tuh3wov5ie9piwvc1dhx_normal.jpeg,false,false
Yale Program on Climate Change Communication,YaleClimateComm,'125767077',false,2010-03-23 16:20:12,"We conduct research on public climate change knowledge, attitudes, policy support & behavior. Posted events are not endorsements.",13251,83517,2675,2983,"New Haven, CT",6793,https://pbs.twimg.com/profile_banners/125767077/1588106122,https://www.twitter.com/YaleClimateComm,https://pbs.twimg.com/profile_images/718090794289274885/3WBiFrXH_normal.jpg,false,false
Yale Rep,yalerep,'125853755',false,2010-03-23 22:32:19,Dedicated to the production of new plays and bold interpretations of classics that make immediate connections to contemporary audiences.,969,3412,493,612,"New Haven, CT",191,https://pbs.twimg.com/profile_banners/125853755/1584549620,https://www.twitter.com/yalerep,https://pbs.twimg.com/profile_images/1240317116319961089/5Tgf8yxt_normal.jpg,false,false
YaleGlobal,YaleGlobal,'31417682',false,2009-04-15 10:20:43,Explore globalization and the connections of our world - with analysis from a public-service magazine published by Yale's MacMillan Center,7105,3402,753,1221,"New Haven, CT",2008,https://pbs.twimg.com/profile_banners/31417682/1532706543,https://www.twitter.com/YaleGlobal,https://pbs.twimg.com/profile_images/1111956749119037440/0o7KAgtE_normal.jpg,false,false
The Information Society Project,yaleisp,'26947239',true,2009-03-27 00:11:59,"The Information Society Project at @YaleLawSch is an intellectual center addressing issues at the intersection of law, tech & society.",9113,15402,1417,4290,"New Haven, CT",683,https://pbs.twimg.com/profile_banners/26947239/1484937467,https://www.twitter.com/yaleisp,https://pbs.twimg.com/profile_images/1695514725608521729/KJkLSlKY_normal.jpg,false,false
Yale CLC,YaleCLC,'81132704',false,2009-10-09 11:26:01,The CLC is winding down. Its work will be transferred to other Yale organizations. We thank you for your years of support!,1055,395,77,1,"New Haven, CT",33,,https://www.twitter.com/YaleCLC,https://pbs.twimg.com/profile_images/461414660/n28052021692_5460_normal.jpg,false,false
Yale Music Library,yalemusiclib,'70754963',true,2009-09-01 14:54:28,Irving S. Gilmore Music Library @yalelibrary,5033,3067,890,191,"New Haven, CT",663,https://pbs.twimg.com/profile_banners/70754963/1483463507,https://www.twitter.com/yalemusiclib,https://pbs.twimg.com/profile_images/913472970634428416/a3JfCfyr_normal.jpg,false,false
Women's Health Research at Yale,WHRYale,'109330131',false,2010-01-28 13:10:38,"Official Twitter of Women's Health Research at @Yale & @YaleMed, an interdisciplinary center focusing on sex & gender health differences. Retweet ≠ endorsement.",6090,2593,1173,3681,"New Haven, CT",1606,https://pbs.twimg.com/profile_banners/109330131/1580328305,https://www.twitter.com/WHRYale,https://pbs.twimg.com/profile_images/1222610989746548736/zApPA2DI_normal.jpg,false,false
Beinecke Library,BeineckeLibrary,'34720331',true,2009-04-23 16:32:18,"""An inspiration to all who enter"" @Yale @Yalelibrary :: visit to engage the past in the present for the future. Home of @WindhamCampbell Prizes",52447,52823,43285,2457,"New Haven, CT",33160,https://pbs.twimg.com/profile_banners/34720331/1590283817,https://www.twitter.com/BeineckeLibrary,https://pbs.twimg.com/profile_images/1272543069313937408/BPqDcsWw_normal.jpg,false,false
Yale Volleyball,YaleVolleyball,'80323012',false,2009-10-06 11:04:12,The official Twitter account of Yale Volleyball. 2024 Ivy League Champions! 14x Ivy League Champions. NCAA Division I & Ivy League member. #ThisIsYale,3401,6946,101,1503,John J. Lee Amphitheater,2130,https://pbs.twimg.com/profile_banners/80323012/1656887945,https://www.twitter.com/YaleVolleyball,https://pbs.twimg.com/profile_images/1543726007454162946/op_pUhvB_normal.jpg,false,false
Yale Field Hockey,YaleFieldHockey,'78622200',false,2009-09-30 11:01:31,The official Twitter account of Yale Field Hockey. NCAA Division I & Ivy League member. #ThisIsYale,6422,1997,157,707,"New Haven, CT",1129,https://pbs.twimg.com/profile_banners/78622200/1656653753,https://www.twitter.com/YaleFieldHockey,https://pbs.twimg.com/profile_images/1542743833854611456/B4uprHJ7_normal.jpg,false,false
Yale Arab Alumni,yalearabalumni,'45120992',false,2009-06-06 08:34:39,A network of over 200 Yale alumni/affiliates with an interest in the Arab World.  Join as a member or friends of YAAA at http://t.co/xVZJUZYyFP,81,493,72,0,Arab World,7,,https://www.twitter.com/yalearabalumni,https://pbs.twimg.com/profile_images/439404232932749312/oSnQG47E_normal.png,false,false
